image,caption
255266148_7ba7df1a88.jpg,كلب أبيض وأسود هو يمشي مع الصحن الطائر الأزرق في فمه
2552723989_7bc93e0f7b.jpg,صبي يسقط من دراجته الحمراء
2552816307_c7c8e7f6b4.jpg,كلب أسود وكلب بني وأبيض يلعبان بعصا في الماء
2552949275_b8cdc450cc.jpg,كلب بني يقفز على الشاطئ
2553024095_735bc46267.jpg,تقف فتاتان يرتديان القبعات الكبيرة  ذات اللونين الأزرق والأزرق الفاتح بجوار جذع شجرة كبير
2553188198_da1123a723.jpg,يمر كلب أسود عبر الماء يحمل كرة في فمه بينما ينظر كلب بني بعيدا
255330891_86d65dfdbf.jpg,زوجان يسيران  مع كلب أبيض أسفل شارع مرصوف
2553550034_5901aa9d6c.jpg,صبي تسلق منطقة صخرية
2553619107_d382a820f9.jpg,المُجدِّف في المياه الضطربة
2554081584_233bdf289a.jpg,المتسلق هو بين اثنين من الصخور الحمراء الكبيرة
2554531876_5d7f193992.jpg,سباقات الدراجات النارية
2554570943_122da6438f.jpg,طفل يتسلق داخل أنبوب أحمر في هيكل اللعبة
2555521861_fc36fd3ab0.jpg,فتاة تحمل على حبل فوق الماء
2555535057_007501dae5.jpg,كلب يجري على طول العشب
2555622234_3e531e4014.jpg,كلب أسود وبني يركض على الشاطئ
2555638166_2f0847d57d.jpg,يلعب ثلاثة أطفال كرة القدم في الرمال
2556392380_ee57514233.jpg,صبي في ثوب يجلس على كرسي
2557129157_074a5a3128.jpg,صبي يتأرجح على الأرجوحة
255741044_1102982213.jpg,اثنين من الكلاب البيضاء والبنية يقفان بجانب بعضها البعض مع لعب حمراء في أفواههم
2557507575_b247f145bc.jpg,كلب بني يركض من خلال العشب الأخضر الطويل
2557922709_24d2a9655a.jpg,فتاة شقراء واثنين من الأعلام الأمريكية
2557972410_6925fe695c.jpg,العديد من اللاعبين يلعبون لعبة الهوكي خارجاً على الطريق
2558312618_13d362df66.jpg,كلب بني يقفز فوق العشب
2558911884_856dfc3951.jpg, مجموعة من الأولاد تلعب في معدات السباحة في حقل تحيط به الأشجار
2559114800_17310f3015.jpg,ثلاثة كلاب تتنافس في سباق الكلاب
2559503010_84f20b3bc9.jpg,رجل يقف خارج مصرف يبيع البطيخ
2559638792_a803ff63d1.jpg,السباح يسبح على الظهر في حوض السباحة
2559921948_06af25d566.jpg,صبي في قميص أصفر يسير على شاطئ يحمل لوح ركوب الأمواج
2560278143_aa5110aa37.jpg,الكلب يلعب في العشب
2560388887_55abc9083d.jpg,مجموعة من الناس تطير الطائرات الورقية الملونة بالقرب من سلسلة جبال جميلة مغطاة بالثلوج
256085101_2c2617c5d0.jpg,الكلب البني والأبيض يتثاؤب
2561212119_1af8cb9b5d.jpg,كلب أسود يقف في الماء
2561295656_4f21fba209.jpg,شخص يرتدي قبعة السباحة ونظارات واقية يأخذ نفسا
2561319255_ce5ede291e.jpg,فتاة تقفز في الهواء بينما تحمل الغيتار البرتقالي والأبيض
2561334141_0aacefa5e7.jpg,رجل يرتدي الجينز و يلعب مع كلب أبيض وبني على الشاطئ
2561341745_2d77d3ff7d.jpg,امرأة تلبس أبيض وأسود تدخن سيجارة في منطقة عشبية
2561481438_447b852e4d.jpg,كلب بني وأسود يقفز من بركة
2561751298_320eef38ec.jpg,يتم تعليق فتاة بالحبال  في الهواء أمام مبنى
2561849813_ff9caa52ac.jpg,طفل يجلس على شاطئ  تحت سماء زرقاء كبيرة
2562166462_b43b141d40.jpg,رجل يرتدي سترة أرجوانية يجلس على مقعد خشبي مع شجرة كبيرة على يساره
2562347802_c049a2ba88.jpg,الكلاب تمشي في الصحراء
2562377955_8d670ccec6.jpg,صبي في القميص البرتقالي على وشك رمي كرة البيسبول
2562463210_d0dfd545ca.jpg,"صبي يرتدي طوافةمرسوم عليها ""سبايدرمان"" يسبح في بركة"
2562483332_eb791a3ce5.jpg,فتاة مراهقة وفتاة صغيرة تلعبان بلعبة وردية اللون
256283122_a4ef4a17cb.jpg,كلب يقفز فوق رجل يرتدي قبعة بيضاء للقبض على الصحن الطائر البرتقالي
256292144_b53aadae27.jpg,كلب أبيض وبني يركض عبر العشب
2563578471_9a4e4c2ecc.jpg,صبي في أسود يجلس على جدار بالقرب من الشاطئ
256439287_990ac4a761.jpg,رجل يجلس على كرسي متحرك بينما تدفعه امرأة
256444892_efcb3bd824.jpg,زوجان يسيران في الشارع
2564663851_3a9832e4fc.jpg,صبي صغير يلعب في صنبور مياه
2564888404_b57f89d3c7.jpg,الكلبان يركضان بجانب الماء
2565237642_bdd46d7cef.jpg,كلب بني يركض في العشب بين الحواجز 
2565350330_c7f305e7f7.jpg,رجل ملتح يضع على ظهره على شجرة كبيرة
2565618804_8d7ed87389.jpg,صبي في ملابس السباحة يجلس على رأس نافورة دائرية
2565657591_6c1cdfc092.jpg,الصبي يتسلق الصخور
2565685680_c30972455d.jpg,كلب أسود يلعب في الماء
2565703445_dd6899bc0e.jpg,رجل ينظر إلى السكة الحديدية في الصباح الهادئ
2567035103_3511020c8f.jpg,اثنين من الكلاب يلعبون في العشب
2567812221_30fb64f5e9.jpg,شخصان يسيران مع الكلاب السوداء على العشب
2568417021_afa68423e5.jpg,صبي يحمل كرة السلة أمام منزل أبيض
2568656919_6e49d2a82b.jpg,اثنين من الكلاب تركض في المياه الضحلة على الشاطئ
256958382_b9006bfc5b.jpg,عداء حافي القدمين في الحديقة
2569643552_23696a9ba5.jpg,اثنين من الجراء الرمادية تمضغ على لعبة بلاستيكية حمراء
2570365455_41cc9a7d2b.jpg,صبيان يظهران ألسنتهما الزرقاء الملطخة
2570559405_dc93007f76.jpg,الكلاب وراء السياج
2571096893_694ce79768.jpg,طفل صغير يمشي خارجاً وسط أوراق الخريف
2572101672_4d699c8713.jpg,رجل يقف بجانب قفص الطيور
2573141440_28a762d537.jpg,طفل في الأرجوحة
2573625591_70291c894a.jpg,الكلاب الثلاثة تركض  في الفناء
2573667207_a1bf49befc.jpg,رجل يمكث على بعض الصخور في المحيط
2574084102_f2be3f73cb.jpg,فتاة صغيرة ترتدي قطعة زرقاء تمارس رياضة الجمباز
2574194729_1f099647ee.jpg,كلب ذو لون فاتح يركض في مسار ضيق
2574230252_f5a1382dd4.jpg,كلب أسود يشق طريقه عبر الماء المخضر
2574509968_e4692ae169.jpg,تقف امرأة كبيرة في الشارع
2575647360_f5de38c751.jpg,يجلس عدد قليل من الناس داخل مبنى يحتوي على الكثير من الصور الفوتوغرافية على الجدران
257588281_39e1c9d929.jpg,كلب بني يركض في الماء بعصا في فمه
2576878141_87f25a10f0.jpg,طفل في سروال أزرق يجلس على زحليقة حمراء
2577972703_a22c5f2a87.jpg,فتاة صغيرة في قميص وردي على وشك البكاء
2578003921_e23b78e85f.jpg,راكب الدراجة الجبلية باللون الأحمر يقود على طريق الغابات
2578161080_e007c9177a.jpg,أربعة رجال يقفون في الخارج أمام سياج
2578289278_01516d23a0.jpg,رجل يجر خيلين مثبتاً الحصان على يمينه
2578395598_6982734d46.jpg,كلب أبيض صغير يركض
2578834476_118585730d.jpg,يذهب سائق الدراجة الترابية إلى أسفل تلة ترابية
2579266054_1ec58aa92f.jpg,كثير من الناس يركبون قطار الموت 
2579268572_d78f8436cb.jpg,مجموعة من الناس يركبون قطار الموت الأصفر
2579460386_94c489028d.jpg,كلب يركض عبر الماء
2579572274_826598b14a.jpg,هناك فتاة صغيرة تحمل هاتفًا خلويًا  لأذنها
2579899436_5086a33c7a.jpg,صبي يرتدي قبعة عيد ميلاد يلعب في بركة
2580215443_4e64afe3d5.jpg,تقف مجموعة من الناس على الرصيف
2581066814_179d28f306.jpg,مجموعة من الناس عراة ويركبون الدراجات في الشوارع
2582390123_71120edb0c.jpg,كلب صغير ينبح في أذن بقرة
2583001715_1ce6f58942.jpg,كلب يطير في الهواء ، يستعد للقبض على الكرة
2584020755_14e2b3e8fc.jpg,طفل يستمتع في حفل الزفاف
2584412512_6767593f24.jpg,كلب أبيض و جرو أبيض و بني يلعبان
2584487952_f70e5aa9bf.jpg,كلب بني يقفز عالياً في العشب
258476074_f28f4a1ae6.jpg,مجموعة من السيارات متوقفة على تلة
2584957647_4f9235c150.jpg,كلب يخوض في المياه العميقة بينما يحمل عصا
2585141045_b496a7b7c4.jpg,صبي صغير ذو شعر بني مجعد ينفخ فقاعات بعصا تمسكها فتاة
2586028627_ddd054d8cc.jpg,صبي صغير يركب دراجة صفراء عبر ساحة البلدة
2586532797_dcf22a5021.jpg,كلب أسود يجلب طائر ميت
2586911841_41b7a48c91.jpg,فتاة في قميص أزرق تقفز في الهواء
2587017287_888c811b5a.jpg,كلب رطب أسمر كبير في المياه الضحلة
2587106431_1cc0e719c6.jpg,يبتسم ثلاثة أولاد يرتدون الأزرق والبرتقالي ويستخدمون الإشارات اليدوية
2587696611_db0378710f.jpg,تسير فتاة في ثوب أبيض أسفل طريق ريفي
2587818583_4aa8e7b174.jpg,شخص بالغ يقوم بسحب طفل من حفرة الكرة
2587846523_b177c9a3e3.jpg,رجل يستعد لرمي كرة للكلب
2588456052_8842b47005.jpg,لاعب تنس يتحضر لرد الكرة القادمة
2588625139_fdf6610218.jpg,صبيان يلعبان بطوق الخصر في الفناء
2588927489_f4da2f11ec.jpg,صبي صغير يأخذ صورة في الحديقة
2589156742_c46bc82137.jpg,رجل أسود يشرب من كوب ورقي
2589241160_3832440850.jpg,كلبان يركضان تجاه بعضهما البعض عبر الرمال
2589308405_e208b5e745.jpg,طفلان يمارسان سباق الكيس
2590207488_ddd89037ba.jpg,كلب أبيض وأسود يسير على الشاطئ
2591110592_ef5f54f91c.jpg,طفل يحمل ثوبًا بينما ينظر إليه طفل آخر
2591455200_2319651f2f.jpg,فتاة شابة طويلة تتسلق نفقًا
2591486448_48d5438343.jpg,الكلب البني يريد الطعام من طبق يحمله الشخص
2591603141_33d6397e0a.jpg,كلب بني وأسود يسير على الشاطئ
2592019072_a6c0090da4.jpg,فتاة صغيرة تمر عبر الفناء
2592711202_55f8c64495.jpg,فتاة في ثوب أزرق تجلس على الأرض تأكل حلوى غزل البنات 
259314892_a42b8af664.jpg,كلب أبيض صغير يلعب مع كلب بني أكبر في الغابة
2593406865_ab98490c1f.jpg,شاب يقلب لوح التزلج أثناء خدعة
2593695271_4d9cc9bd6f.jpg,يمشي الصبي في قميص أصفر وراء شخصين ويمر بتمثال
2594042571_2e4666507e.jpg,صبي يلبس قميصاً برتقالياً يبتسم ، بينما ينظر صبي في قميص أزرق
2594336381_a93772823b.jpg,صبي صغير ذو وجه قذر يستلقي على سجادة ملونة
2594459477_8ca0121a9a.jpg,فتاة صغيرة في بركة مياه الأمطار
2594902417_f65d8866a8.jpg,كلب يقفز في حقل بينما كلب آخر يقف بجانبه
2595102568_347f6d4b07.jpg,مجموعة من ثلاثة أشخاص يسيرون في الشارع
2595186208_9b16fa0ee3.jpg,كلب أسود يقفز من رصيف إلى ماء
2595713720_30534e8de2.jpg,فتاة ترتدي قبعة وردية تسير بجانب غنم على طريق ترابية
2596100297_372bd0f739.jpg,اثنين من الأولاد يلعبون في الأمواج على الشاطئ
2596474836_79468f23a0.jpg,امرأة تساعد طفلا على السباحة في بركة
2596475173_58f11fc583.jpg,كلب أسمر  و آخر أسود يتقاتلان
2596514158_c516e57974.jpg,صبي صغير في سترة نجاة يقفز إلى بركة
2596619849_7b635dd310.jpg,يلعب أربعة أطفال في حقل عشبي
2596876977_b61ee7ee78.jpg,طفلان يبتسمان لالتقاط صورة لهما في حمام السباحة
2597308074_acacc12e1b.jpg,صبي وفتاة على الشاطئ ، يرمون الرمال
2597737483_6518a230e4.jpg,صبي ينزلق
2597873827_a5cb3e57ba.jpg,طفل يركع ويرفع ذراعيه
2597958208_e03aa149c9.jpg,صبي صغير وفتاة صغيرة يلعبان معاً في الخارج
2598012140_832863fcb9.jpg,كلب يعض قطة وهي مستلقية على السرير 
2598979962_c01811cfca.jpg,لاعب تنس يرتدي قميصًا أحمر اللون على وشك أن يضرب كرة التنس بمضربه
2599131872_65789d86d5.jpg,فتاتان شقراوتان تلعبان معا
2599444370_9e40103027.jpg,كلب و قطة يسبحان في حمام السباحة
2599903773_0f724d8f63.jpg,صبي في قميص منقوش ينفخ فقاعات بعصا فقاعات صفراء
2600170955_bf30c5d5c0.jpg,فتى متحمس يدفع عربة تسوق تحتوي على فتى مبتسم
2600386812_8790879d9a.jpg,كلب بني يقف في الماء يراقب أمواج المحيط في يوم مشمس
2600442766_e750ec9a56.jpg,الكلبان البني والأسود يلعبان في الماء
2600867924_cd502fc911.jpg,كلب بني كبير وكلب كبير أبيض وأسود يركضان معاً
2600883097_aca38cc146.jpg,كلبان بنيان يلعبان في المياه الضحلة
2601008162_f00eeb5c14.jpg,طفل يحمل كاميرا أمام وجهه
2601612082_4b9be27426.jpg,مجموعة من الأطفال الصغار يلعبون على قارب بلاستيكي داخل منزل
260162669_c79a900afb.jpg,كلب أسود وفضي نحيل في العشب
2602083686_e8a1af69cf.jpg,اثنين من النساء العاريات باللونين الأسود والأبيض يركبن الدراجات على الطريق
2602085456_d1beebcb29.jpg,امرأة عارية مغطاة بالطين أمام حشد من الناس
2602258549_7401a3cdae.jpg,زوجان يمسكان بأيديهم عبر طاولة
2602279427_191773c9e2.jpg,فتاة شرقية ترتدي مئزرًا أصفر و قبعة
2602306033_2b3100d36b.jpg,الكلب الأسود يعض على شيء وهو يسبح في الشاطئ
260231029_966e2f1727.jpg,كلب أسود وكلب بني يركضان في الرمال
2602415701_7674eb19e4.jpg,مجموعة من الأطفال تقفز في بركة السباحة
2602679255_785b851b46.jpg,فتاة في زي غريب تكب دراجتها
2602866141_be9928408d.jpg,مجموعة من الأولاد تراقب صبيًا آخر يسير بعيداً
2603033456_3584d95116.jpg,صبي في الأبيض والأحمر على الشاطئ
2603125422_659391f961.jpg,سيارة متوقفة في شارع مليء بالكتابة على الجدران
2603334363_cfa32c4482.jpg, فتاة ترتدي الزي الخيالي تقود دراجة ثلاثية العجلات
2603690144_7a28b1d13c.jpg,يركض فتى وكلب أمام مجموعة من الناس
2603792708_18a97bac97.jpg,مجموعة من الناس على الشاطئ عند غروب الشمس
260392825_ea61660633.jpg,رجل أسود في قميص أحمر
2604305843_ebe3e8a328.jpg,طفل في متنزه يركب أرجوحة
2604825598_593a825b5b.jpg,يقفز كلب بني وأبيض فوق جذع في حقل بينما يتبعه كلب آخر خلفه
260520547_944f9f4c91.jpg,يسير مجموعة من الناس على رصيف بجانب الشاطئ
2606433181_f8f9d38579.jpg,اثنين من الكلاب تلعب في العشب
2607099736_8681f601d9.jpg,مصارع يقفز ويشير إلى الحصيرة
2607130765_97833d6ce1.jpg,يلعب الأطفال في لعبة كرة القدم
2607383384_d9ce9de793.jpg, أربع نساء يرتدين آذان الأرنب يلفتن الانتباه
2607462776_78e639d891.jpg,كلب أسود يقفز من سطح خشبي إلى بحيرة
260828892_7925d27865.jpg,رجل يمشي على الشاطئ ويترك بعض آثار الأقدام وراءه
2608289957_044849f73e.jpg,طفل يجلس على إطار ويحمل لعبة
260850192_fd03ea26f1.jpg,أقدام الشخص تخرج من كهف صغير
2609836649_b55831ed41.jpg,كلب أبيض وأسود يسبح في حوض سباحة في الفناء الخلفي
2609847254_0ec40c1cce.jpg,فتاة تبتسم في الكاميرا مع حشد من الناس وراءها
2609900643_c07bcb0bae.jpg,فتاة تتأرجح على حبل أرجوحة
2610447973_89227ff978.jpg,شخصان يجلسان بالقرب من نيران مشعلة بالخشب في الليل
2611651553_61f859837e.jpg,امرأة عارية مع جسدها مطلي 
2612040125_0a93889f06.jpg,اثنين من الكلاب تطارد كرة القدم في ملعب
2612488996_9450de0e54.jpg,يقف رجل بلا مأوى في غطاء أبيض خلف مخاريط برتقالية كبيرة
2612608861_92beaa3d0b.jpg,الأطفال يشاهدون شيء ما يحدث
2612949583_f45b3afe33.jpg,صبي صغير يتبع أربعةمن الإوز
2613021139_4b0dc3d4c8.jpg,فتاة صغيرة تتأرجح على الأرجوحة
2613209320_edf6a2b7e9.jpg,كلب يخرج من الماء
2613889835_6f50a3b83b.jpg,رجل في زورق  برتقالي ورجل في زورق أزرق حول بحيرة جميلة
2613920405_e91e6ebd7a.jpg,رجل يُسيِّر بقرة على جانب الطريق
2613993276_3c365cca12.jpg,كلب في حقل عشبي يركض مع كرة في فمه
261490838_2f3ac98b12.jpg,كلب يطارد غزالا في الغابة
2615623392_ab2b9759ae.jpg,فتاة تأرجح أخاها الصغير في الفناء
2615811117_42b1838205.jpg,طفل سعيد يرتدي سترة نجاة برتقالية
2616009069_82561da2e5.jpg,كلب أبيض وبني يركض في منطقة عشبية
2616284322_b13e7c344e.jpg,الكلاب ترتدي قمصان مرقمة تركض في مسار
2616508003_fa5ca5780d.jpg,رجل يركب دراجة بخارية على عجلة واحدة
2616561200_ea079f285a.jpg,كلب يطارد كرة
2616643090_4f2d2d1a44.jpg,طفل يمضغ النباتات
2616673985_fa4354cc53.jpg,امرأة ترتدي رمادي تمسك بمقود الكلب الأسود
261737543_b8fdc24671.jpg,رجل يقف على تلة تطل على المدينة
2618322793_5fb164d86a.jpg,صبي يتأرجح على أرجوحة
2618538137_44fffe10c4.jpg,رجل مع لوح تزلج يجلس القرفصاء بجوار كلب كبير
261883591_3f2bca823c.jpg,رجل يرتدي قبعة بلون أبيض يجلس أمام شاحنة خضراء
2618866067_07cbc83dc5.jpg,كلب رمادي يتثاءب
2619267133_53a5904ef4.jpg,صبي صغير يرتدي قبعة رعاة البقر يركب حصانًا
2619454551_c4bb726a85.jpg,طائر ذو ألوان زاهية وكلب صغير
2620113705_a8fa89b8f6.jpg,كلب أبيض صغير يجلس في حقل
2621415349_ef1a7e73be.jpg,رجل يرتدي قبعة حمراء لديه شريحة البطاطس في فمه
2621771656_09a620da6d.jpg,مجموعة من الناس ينتظرون خلف الحاجز وينظرون نحو اليمين
2622517932_57c52c376f.jpg,صبي في قميص أبيض يبحث في الزجاج عن مخلوق صغير
2622624460_207dbcc4cf.jpg,كلب أسود يطارد كرة حمراء عبر الماء
2622971954_59f192922d.jpg,رجل في حشد يعبر عن رأيه
2623146491_b64698b875.jpg,رجل أسود يشتري شيئًا من متجر
2623247254_3bfc795121.jpg,رجل يتحدث ويفعل شيئا بيده بينما يجلس الآخرون بالقرب منه
2623496164_68ffeb5067.jpg,راكب الدراجة النارية الحمراء يقود في الريف
2623560640_0445c9a138.jpg,رجل وفتاة يقفان تحت شجرة كبيرة من الخشب الأحمر
2623930900_b9df917b82.jpg,رجل ذو لحية كثيفة وقميص وردي يبتسم
2623939135_0cd02ffa5d.jpg,امرأة ترتدي ثوبًا ترفع ذراعيها فوق رأسها
2623982903_58ec7c5026.jpg,الكلاب تتسابق بعضها البعض على مسار موحل
2624044128_641b38c0cf.jpg,صبيان يرتديان لباس أبيض يعملان على مسار في حقل
262439544_e71cd26b24.jpg,طفل يرتدي قميصا أحمر اللون معلقة رأسا على عقب من شجرة
2624457062_89efc497a8.jpg,رجل مسن مع نظارات وشوارب بيضاء يقف أمام مبنى مهجور
262446581_06ef7d9445.jpg,رجل يجلس على قطعة قديمة من الخشب بالخارج
262570082_6364f58f33.jpg,كلب مع عصا يتبع كلب آخر خلال الماء
2626158969_ac09aeb88d.jpg,الصبي ذو الشعر الداكن موجود في الماء وينظر للأعلى
262642489_f5c6b9e65b.jpg,كلب كبير بني يسبح نحو الكاميرا
262681159_e5fed3acf0.jpg,فتاة تلعب مع قلادة لها في الليل
2628331789_c7f7d90e5d.jpg,امرأة تمسك بصبي صغير يقفز في بركة السباحة
2629027962_9cc3b46527.jpg,طفل تضع رأسها في مقطع بقرة
2629294578_853a08bb43.jpg,الكلب البني يجلب الكرة
2629295654_59ea1472a1.jpg,كلب بني يركض على العشب
2629334536_11f2d49e05.jpg,طفل في قميص أزرق على أرجوحة
2629346153_155ba73ae9.jpg,كلب هجوم بني و أسود يُدرَّب من قبل رجل يحمل عصا
2629402527_6dfc5c504b.jpg,كلب يركض على العشب
2629445284_83390e83af.jpg,كلب أبيض وأسود يقفز فوق عقبة
262963190_a78b799e89.jpg,متسلق يقف على الصخور المطلة على سلسلة جبال ثلجية
2630507245_bea4804288.jpg,كلب السلوقي يركض عبر  منعطف على مسار موحل
2630806789_6835bbae95.jpg,ثلاثة قوارب على الماء مع جبل في الخلفية
2631300484_be8621d17b.jpg,يقف الصبي الشقراء بين الناس في وضع مشبوه مع ثعبان كبير ملفوف حول صدره
2631625732_75b714e685.jpg,الناس يجدفون في المناطق الثلجية والجبلية
2632111399_b3c1630f8e.jpg,طفل صياد يرتدي خوذة ، يمد يديه لالتقاط شيء ما
263216826_acf868049c.jpg,زوجان يجلسان فوق جبل ينظران إلى أسفل المنظر
263231469_e85c74f5fd.jpg,شخص مغطى بوجهه ، يقف في الصحراء
263233914_d25004e4cd.jpg,فتاة صغيرة ترتدي ثوب السباحة الوردي تضحك وهي في حوض السباحة
2632366677_43dee456a5.jpg,كلب بني بجانب مقعد من الحجر
2632381125_de32bdfdf6.jpg,كلبان بنيان يلعبان مع الصحن الطائر في الماء
2633082074_32c85f532c.jpg,صبي تسلق شجرة
2633201394_ee4a7666ed.jpg,كلب بني يسبح ويحمل شيء بني
2633722629_5eeb649c09.jpg,طفل يتقلب على النطاطة 
2635023078_6dae04758f.jpg,يقف رجلان خارج مبنى تم رسم الكلمات عليه بغزارة
2635164923_2a774f7854.jpg,تزلج طفل صغير على جدار خرساني صغير
263522013_d118d46b2d.jpg,كلب ينفض الماء
2635400219_2e1a984fd3.jpg,امرأة وولد كلاهما يرتديان ملابس عربية تقليدية زرقاء
2635483351_bc1a8273aa.jpg,كلب أسود يجلس على الأرض
2635905544_dbc65d0622.jpg,اثنين من الكلاب يلعبون مع كرة حمراء وبيضاء
2635908229_b9fc90d3fb.jpg,صبي يجلس على جذع شجرة
2635938723_11b85e6763.jpg,صبي صغير يأكل المصاصة الحمراء
2636514498_01fcc5f501.jpg,طفل صغير يرتدي زي أزرق مع حذاء أزرق
2636876892_9353521a1c.jpg,اثنين من الكلاب يشمون بعضهما البعض
2637510448_4521cf6f29.jpg,طفل باللون الوردي والأبيض ينزلق على زحليقة 
2637904605_fc355816fc.jpg,كلب أبيض وأسود يمر عبر العشب
2637959357_dd64a03efa.jpg,كلب يقفز من خلال الماء في البحيرة
2638369467_8fc251595b.jpg,فتاة في ثوب أبيض
263850317_5bb3a18a08.jpg,فتاة آسيوية تحمل حقيبة وردية تسير في أحد شوارع المدينة المزدحمة
263854883_0f320c1562.jpg,كلبان يركضان عبر العشب
2638981862_6b23833f37.jpg,اثنين من الصبية الصغار في البدلات الرسمية
2640000969_b5404a5143.jpg,كلب كبير بني يقفز إلى بركة السباحة في الفناء الخلفي
2640153227_57cf1a3d92.jpg,فتاة صغيرة تأكل كعك
2641288004_30ce961211.jpg,كلب يقفز مع كرة في فمه
264141937_585320617a.jpg,امرأة تحمل حقيبة بيضاء مليئة بأوراق الدولار
2641770481_c98465ff35.jpg,رجل يرتدي سترة حمراء يقف بالقرب من زورق أصفر
2642350864_099c0f2152.jpg,فتاة صغيرة تركب أمام عربة تسوق في متجر
