image,caption
1000268201_693b08cb0e.jpg,طفلة صغيرة تتسلق إلى مسرح خشبي
1001773457_577c3a7d70.jpg,كلب أسود وكلب ثلاثي الألوان يلعبان مع بعضهما البعض على الطريق
1002674143_1b742ab4b8.jpg,فتاة صغيرة مغطاة بالطلاء تجلس أمام قوس قزح
1003163366_44323f5815.jpg,رجل يجلس على مقعد بينما يجلس كلبه بجانبه
1007129816_e794419615.jpg,رجل يرتدي قبعة برتقالية
1007320043_627395c3d8.jpg,طفل يلعب على حبل
1009434119_febe49276a.jpg,كلب أبيض وأسود يركض في حديقة عشبية محاطة بسياج أبيض
1012212859_01547e3f17.jpg,كلب يهز رأسه بالقرب من الشاطئ ، كرة حمراء بجانبه
1015118661_980735411b.jpg,صبي يبتسم أمام حائط صخري في مدينة
1015584366_dfcec3c85a.jpg,كلب أسود يقفز فوق الجذع
101654506_8eb26cfb60.jpg,كلب أبيض وأبيض يمر عبر الثلج
101669240_b2d3e7f17b.jpg,رجل في القبعة يعرض صورًا بجوار أحد المتزلجين في قبعة زرقاء
1016887272_03199f49c4.jpg,صور لشخص واحد يتسلق جرفًا
1019077836_6fc9b15408.jpg,كلب بني يطارد الماء على العشب
1019604187_d087bf9a5f.jpg,كلب يستعد للقبض على جسم في حقل مع السيارات القريبة
1020651753_06077ec457.jpg,كلب أبيض وأسود يقفز في الهواء للحصول على لعبة
1022454332_6af2c1449a.jpg,طفل وامرأة على حافة المياه في مدينة كبيرة
1022454428_b6b660a67b.jpg,زوجان يجلسان على العشب مع رضيع وعربة أطفال
1022975728_75515238d8.jpg,كلب يقفز في الماء
102351840_323e3de834.jpg,رجل يحفر حفرة في الجليد
1024138940_f1fefbdce1.jpg,كلاب بيضاء تلعب على الشاطئ
102455176_5f8ead62d5.jpg,رجل يتسلق الجليد
1026685415_0431cbf574.jpg,كلب أسود يحمل شيئًا على العشب
1028205764_7e8df9a2ea.jpg,رجل ورضيع في قوارب الكاياك الصفراء على الماء
1030985833_b0902ea560.jpg,كلب أسود وكلب بني يقفزان للقبض على لعبة حمراء
103106960_e8a41d64f8.jpg,طفل يرتدي سترة حمراء يلعب هوكي
103195344_5d2dc613a3.jpg,رجل يجلس ويقرأ صحيفة
103205630_682ca7285b.jpg,يتم وضع خيمة على الجليد
1032122270_ea6f0beedb.jpg,امرأة تجثم بالقرب من ثلاثة كلاب في حقل
1032460886_4a598ed535.jpg,رجل يقف أمام ناطحة سحاب
1034276567_49bb87c51c.jpg,طفل يقضم سلعة مخبوزة
104136873_5b5d41be75.jpg,ثلاثة أشخاص على قمة تطل على واد أخضر
1042020065_fb3d3ba5ba.jpg,صبي في قميص أخضر يشاهد القوارب
1042590306_95dea0916c.jpg,رجل وامرأة يمثلان للكاميرا بينما ينظر رجل آخر
1045521051_108ebc19be.jpg,شخص يجلس على الأرض ويأكل أمام التلفزيون
1048710776_bb5b0a5c7c.jpg,بضعة أشخاص يجلسون على حافة تطل على الشاطئ
1052358063_eae6744153.jpg,يقوم الطفل بأداء خدعة لوح التزلج بينما يميل طفل آخر يحمل لوح تزلج على الحائط
105342180_4d4a40b47f.jpg,فتاة تتجول في نهر كبير
1053804096_ad278b25f1.jpg,فتاة تلعب في الأمواج
1055623002_8195a43714.jpg,مجموعة من الأطفال يتعاركون بالوسادات
1055753357_4fa3d8d693.jpg,اثنين من عمال البناء يأخذون استراحة
1056249424_ef2a2e041c.jpg,يلعب الأطفال في الماء
1056338697_4f7d7ce270.jpg,امرأة شقراء في قميص أزرق تنتظر رحلة
1056359656_662cee0814.jpg,فتاة صغيرة تنظر في كتيب عن ركوب القطار
1056873310_49c665eb22.jpg,كلب أسود يركض خلف كلب أسود على شاطئ صخري
1057089366_ca83da0877.jpg,صبي ينزل عن لوح الغطس العالي
1057210460_09c6f4c6c1.jpg,رجل يقف بجانب نافذة يخلع قميصه
1057251835_6ded4ada9c.jpg,كلب خفيف اللون يركض على الشاطئ
106490881_5a2dd9b7bd.jpg,صبي في ملابس السباحة الزرقاء على الشاطئ
106514190_bae200f463.jpg,مسافر يقف على قمة تطل على الجبال أدناه
1067180831_a59dc64344.jpg,كلب أبيض وأسود يقفز وراء لعبة صفراء
1067675215_7336a694d6.jpg,رجل يرتدي سراويل زرقاء اللون في الشارع
1067790824_f3cc97239b.jpg,كلب أبيض وأسود وكلب بني في الرمل
1072153132_53d2bb1b60.jpg,كلب أبيض وأسود يمسك لعبة في الجو
107318069_e9f2ef32de.jpg,حشد يشاهد بالونات الهواء في الليل
1075716537_62105738b4.jpg,طفل مع خوذة على رأسه يركب دراجة
107582366_d86f2d3347.jpg,تجمع مجموعة من الناس في الظلام
1075867198_27ca2e7efe.jpg,رجل في قميص بني وشورت غامق يلعب على الشاطئ مع اثنين من الكلاب السوداء
1075881101_d55c46bece.jpg,صبي ينظف الفقاعات من وجهه
1077546505_a4f6c4daa9.jpg,ينزلق صبي في شورت أزرق إلى أسفل في بركة
1077931201_1e0bb83105.jpg,رجل في الماء يرمي صبيًا صغيرًا في الهواء وينتظر أن ينزل حتى يتمكن من الإمساك به
1079274291_9aaf896cc1.jpg,صبي صغير يخرج لسانه من أجل الكاميرا
10815824_2997e03d76.jpg,حصان أشقر وفتاة شقراء في قميص أسود يحدقان في نار في برميل
1082252566_8c79beef93.jpg,كلب نحيف كبير يقف بالقرب من كلبين أصغر حجما
1082379191_ec1e53f996.jpg,سيدة ورجل بدون قميص يجلسان على منصة
1084040636_97d9633581.jpg,كلب أبيض كبير ملقى على الأرض
1084104085_3b06223afe.jpg,امرأة في شورت أزرق وقميص أبيض تتسلق الصخور في مكان مغلق
1087168168_70280d024a.jpg,صبي يقفز في الماء
1087539207_9f77ab3aaf.jpg,عائلة تلعب على جرار في يوم جميل
1088767354_2acee738cf.jpg,امرأة في زي أحمر
108898978_7713be88fc.jpg,رجلان يتزلجان في الثلج في منطقة حرجية
108899015_bf36131a57.jpg,متسلق وحيد يشق طريقه فوق الجبل
1089181217_ee1167f7af.jpg,كلب بني يهرول في طريق ممهد
1089755335_0bfbfd30e6.jpg,الأم والطفل يصطادان على الممر في الليل
109202756_b97fcdc62c.jpg,امرأة ترتدي سترة زرقاء وجينز أزرق تركب حصانًا بنيًا بالقرب من بحيرة متجمدة وجبل مغطى بالثلج
109202801_c6381eef15.jpg,اثنين من الخيول تسحب عربة عبر الثلج
109260216_85b0be5378.jpg,شخص يتسلق صخرة باستخدام حبل
109260218_fca831f933.jpg,يقف الناس داخل قبة صخرية
1093716555_801aacef79.jpg,مجموعة من الرحالة تكمن على الأرض الجافة
1093737381_b313cd49ff.jpg,امرأة ترتدي ثوبًا أزرق اللون تقف مع صورة طباشيرية لطفلين يلعبان في نهر
1094462889_f9966dafa6.jpg,كلب بني يلعب في كومة من الثلج العميقة
1095476286_87d4f8664e.jpg,صبي يقفز في نافورة
1095580424_76f0aa8a3e.jpg,كلب يخرج من نفق
1095590286_c654f7e5a9.jpg,كلب يطارد كلب آخر
1095980313_3c94799968.jpg,فتاة صغيرة في ملابس السباحة الزرقاء تمشي على طول سياج خشبي بجوار شاطئ رملي
1096097967_ac305887b4.jpg,كلب أبيض وأسود يشرب الماء
1096165011_cc5eb16aa6.jpg,صبي يبتسم تحت الماء
1096395242_fc69f0ae5a.jpg,صبي مع بندقية لعبة
109671650_f7bbc297fa.jpg,صبي يرتدي الأزرق والأصفر يسير على حافة منحدر
109738763_90541ef30d.jpg,شخص على عربة الثلج في منتصف القفزة
109738916_236dc456ac.jpg,الناس يركبون على عربات الثلوج
109823394_83fcb735e1.jpg,ثلاثة أشخاص يقودون مركبات رباعية الدفع
109823395_6fb423a90f.jpg,مركبة بأربع دواليب تقفز في حقل فارغ
109823397_e35154645f.jpg,رجل يقفز في الهواء أثناء ركوب مركبة
1100214449_d10861e633.jpg,صبي في قميص مقلم يقفز أمام نافورة ماء
1104133405_c04a00707f.jpg,صبي يحمل كرة قدم
1105959054_9c3a738096.jpg,طفل يرسم صورة
110595925_f3395c8bd6.jpg,يقود راكب الدراجة دراجة على طريق
1107246521_d16a476380.jpg,كلب أسود يقفز للقبض على لعبة حبل
1107471216_4336c9b328.jpg,فتاة صغيرة تمسك بكاميرا سينمائية
1110208841_5bb6806afe.jpg,كلب أبيض وبني يمسك بالفريسبي في فمه أمام مجموعة من الناس
1112212364_0c48235fc2.jpg,طفل يرص الصخور على الشاطئ
111497985_38e9f88856.jpg,شاب يتسلق تلة صخرية
111537217_082a4ba060.jpg,رجل يتسلق جدار صخري
111537222_07e56d5a30.jpg,رجل يصعد جدار صخري
1115565519_d976d4b1f1.jpg,طفل يلعب مع نافورة على الشاطئ
1115679311_245eff2f4b.jpg,كلب أسود يقفز فوق حائط على الشاطئ
111766423_4522d36e56.jpg,عصفور أبيض وأسود يأكل من يد شخص ما
1117972841_2b9261f95f.jpg,كلب بني يركض في الرمال
1118557877_736f339752.jpg,صبي صغير يقف في الأمواج
1119015538_e8e796281e.jpg,كلب مرعب يركض عبر العشب
1119418776_58e4b93eac.jpg,كلب أسود وبني وأبيض يركض في حقل
1119463452_69d4eecd08.jpg,فتاة تسبح في بركة
1121416483_c7902d0d49.jpg,طفل يقف على رأسه
112178718_87270d9b4d.jpg,رجل يقف في الرمال مع لوح التزلج خلفه
112243673_fd68255217.jpg,يتجول ثلاثة أشخاص على دراجات
1122944218_8eb3607403.jpg,يحمل الطفل علم أسود صغير عليه قمر ونجم
1124448967_2221af8dc5.jpg,ينام رجل نصف عاري على كرسيه في الهواء الطلق
1129704496_4a61441f2c.jpg,كلاب تسترد لعبة من الماء
1130017585_1a219257ac.jpg,شباب يحتفلون في الشوارع
1130369873_d80a1aa59c.jpg,كلب أبيض يرش في الماء بينما يحمل كرة في فمه
1130401779_8c30182e3e.jpg,اثنين من الكلاب البنية في الماء
1131155939_b4b457b05e.jpg,كلب أسود يركض في المحيط بجانب كومة من الأعشاب البحرية
1131340021_83f46b150a.jpg,صبي صغير يعمل بينما يرتدي الصنادل
1131800850_89c7ffd477.jpg,كلب أبيض وبني يقف خارجا في الثلوج
1131804997_177c3c0640.jpg,رجلان يجلسان على الأرض ويبحثان في حقائب الظهر
1131932671_c8d17751b3.jpg,صبي يقفز على السرير
1132772170_600610c5df.jpg,طفل يقفز من الفراش إلى السرير
113678030_87a6a6e42e.jpg,يرتاح المتزلج على الجبال
1138784872_69ade3f2ab.jpg,فتاة تلبس الأخضر تسير في شارع المدينة
114051287_dd85625a04.jpg,صبي يرتدي زي كرة القدم ويحمل حذاءه يخرج من السيارة
1141718391_24164bf1b1.jpg,رجل وامرأة يعبران فوق جسر
1141739219_2c47195e4c.jpg,عائلة تجمعوا في سيارة مطلية
1142283988_6b227c5231.jpg,امرأة شابة تمتثل مع شخص يرتدي زيًا ورديًا
1142847777_2a0c1c2551.jpg,راكب دراجة في أحد شوارع المدينة
1143373711_2e90b7b799.jpg,متسابق الدراجات يعبر الشارع
1143882946_1898d2eeb9.jpg,سيدة ترتدي خوذة تركب دراجة
1144288288_e5c9558b6a.jpg,امرأة مرتدية قميصا أبيض وشورتا أزرق ترتدي سماعات الرأس
1148238960_f8cacec2fc.jpg,يقف راكبو الدراجات عند تقاطع
1149179852_acad4d7300.jpg,رجل بلا قميص يرافق حصانًا يسحب عربة على طول طريق مرصوف
114949897_490ca7eaec.jpg,صبي يضرب الكرة إلى الشباك
1151466868_3bc4d9580b.jpg,فتاة صغيرة تلعب في المياه الضحلة
1153704539_542f7aa3a5.jpg,فتاة تلعب البوق في فرقة موسيقية
1155138244_859fd6e079.jpg,فتاة آسيوية في قبعة خضراء تقدم المشروبات على صينية
115684808_cb01227802.jpg,يقوم ثلاثة رجال بإعداد زلاجة في سهل ثلجي
1159574340_99ba8c3c59.jpg,طفل يقفز في الماء مع حذاءه الرياضي
1160034462_16b38174fe.jpg,رجل مسن في قبعة من القش يجلس على مقعد
1160441615_fe6b3c5277.jpg,تسير ثلاث فتيات تحت حاجز على طريق تحيط به الأشجار
1163282319_b729b24c46.jpg,فتاة ترتدي قبعة حمراء وشورتاً بألوان فاتحة ، تجلس على صخرة في الخارج
116409198_0fe0c94f3b.jpg,رجل يأكل قرب خيمة في الثلج
1164131282_b30926f332.jpg,اثنين من الكلاب يتصارعان مع بعضها البعض
1164765687_7aca07bbe7.jpg,رجل في قميص أحمر يعطي ألعاب لكلب صغير
1167662968_e466f1e80a.jpg,رجل مع حلقة الأنف
1167669558_87a8a467d6.jpg,رجل يلبس الأصفر
1167908324_8caab45e15.jpg,رجل يقف بجانب مجموعة من ألعاب الفيديو في حانة
1169307342_e7a4685a5c.jpg,كلب كبير بني يلعب مع كلب رمادي أصغر على العشب
1174525839_7c1e6cfa86.jpg,فتاة تقفز في الهواء بجانب المحيط
1174629344_a2e1a2bdbf.jpg,حشد من الناس يسيرون على رصيف مزدحم
1176580356_9810d877bf.jpg,كلب كبير يمسك كرة على أنفه
1177994172_10d143cb8d.jpg,صبيان يرشان بعضهما ببعض بالماء
1178705300_c224d9a4f1.jpg,كلب بني يقفز في بركة خلف كرة
118187095_d422383c81.jpg,يدفع الآباء الأطفال الصغار في سيارات حمراء
118309463_a532b75be9.jpg,فريق البيسبول الأولاد يرتدون زيهم الرسمي
1184967930_9e29ce380d.jpg,كلب بني يركض عبر العشب والزهور
1187435567_18173c148b.jpg,كلب صغير باللونين البني والأسود
1187593464_ce862352c6.jpg,كلب يمر عبر حقل عشبي بعصا في فمه
1189977786_4f5aaed773.jpg,كلب يقفز في حمام السباحة
1191338263_a4fa073154.jpg,سيدة تجلس بجوار إعلان
1193116658_c0161c35b5.jpg,فتاة رتركب الدراجة الهوائية الأحادية العجلة
119534510_d52b3781a3.jpg,رجل في قميص بني يجلس على منصة ويقرأ
1197800988_7fb0ca4888.jpg,شخص يجلس على طاولة خلف شجرة
1198194316_543cc7b945.jpg,زوجان يمشيان على رصيف
1204996216_71d7519d9a.jpg,صبي ينام على مقعد طاولة نزهة
1206506157_c7956accd5.jpg,الكلاب تتقاتل في العشب على لعبة
1207159468_425b902bfb.jpg,صبي يمتثل لصورة وفي الخلفية يتعلق رجل بحبل
1211015912_9f3ee3a995.jpg,فتاة في ثوب بني يحيط بها الأطفال
1213336750_2269b51397.jpg,رجل يرتدي سترة سوداء يأخذ صورة لرجل يرتدي سترة حمراء
1215334959_b1970965f7.jpg,عائلة تجلس على مقعد بالقرب من الشاطئ
121800200_bef08fae5f.jpg,تسلق مجموعة من متسلقي الصخور جدارًا صخريًا في إحدى الغابات
121971540_0a986ee176.jpg,يتسلق رجلان القارب
1220401002_3f44b1f3f7.jpg,طفلان يضحكان في العشب
1222322358_225067636e.jpg,صبي في قميص أحمر وأبيض على الأرجوحة
1224851143_33bcdd299c.jpg,صبي يأكل بملعقة
1225443522_1633e7121f.jpg,فتاة تمشي لوحدها في الليل في أحد الشوارع
1227655020_b11a1bb112.jpg,كلب أسود وكلب أسمر يلعبان في أعشاب ضارة
1229756013_94663527d7.jpg,كلب بني يقفز في الهواء على سهل بني
1231229740_8dcbf80bfb.jpg,ينام الطفل ذو الملابس الرمادية على وسادة حمراء
1232148178_4f45cc3284.jpg,طفلة تعلب في حديقة
1234293791_6566284bcd.jpg,فتاة في خوذة ركوب الخيل
1234817607_924893f6e1.jpg,رجل كوري يبيع الصودا
1235580648_7eebaed9bc.jpg,رجلين في القبعات العالية يعبسون للكاميرا
1235681222_819231767a.jpg,شخص في قميص أزرق يجلس وراء شخصين يجلسان على مقعد خشبي
1235685934_be89b231fb.jpg,رجل في النظارات الشمسية
1236951314_0308dc4138.jpg,صبي في ثوب السباحة يقفز إلى بركة مع رجل أصلع
1236964638_1808784a3c.jpg,صبي يقفز من لوحة الغوص الى بركة
1237985362_dbafc59280.jpg,سيدة تحمل فتاة صغيرة تحاول التقاط فقاعات
123889082_d3751e0350.jpg,كلب أسمر يعض أذن كلب رمادي
123997871_6a9ca987b1.jpg,الفتيات يرتدين الزي الرياضي
1240297429_c36ae0c58f.jpg,كلب يجري في حقل
124195430_d14028660f.jpg,حصان أسمر ومهر أسود على الشاطئ
1244140539_da4804d828.jpg,كلب بني وأسود ينام سجادة أشعث
1244306891_8e78ae1620.jpg,مجموعة من الأصدقاء يبتسمون لالتقاط صورة على الشاطئ
1244485675_822e6efe60.jpg,صبي في قميص رمادي وأبيض ينظر إلى انعكاسه
1245022983_fb329886dd.jpg,فتاة صغيرة ترقص و يديها على الوركين
1247181182_35cabd76f3.jpg,رجل يجلس على صخرة
1248357227_2b4175fc39.jpg,ثلاثة أطفال ينظرون إلى الماء على ضفاف البحيرة
1248734482_3038218f3b.jpg,صورة مقربة لفتاة شابة ذات قميص وردي ترقد على العشب
124881487_36e668145d.jpg,رجل يركب دراجة أسفل تلة صخرية
1248940539_46d33ed487.jpg,يلعب ثلاثة أطفال في الرمال بالقرب من الشاطئ
1248953128_24c9f8d924.jpg,تلعب فتاة صغيرة في ثوب ملون بكرة القدم الزرقاء والحمراء
124972799_de706b6d0b.jpg,كلب يلعب مع القط المختبئ تحت مقاعد البدلاء
1251558317_4ef844b775.jpg,شخص بالغ وطفل يجلسان على دراجة نارية تابعة للشرطة
1252396628_eb81d3905b.jpg,رجل يركب الدراجة الترابية في مسار
1252787177_4b08625897.jpg,ثلاثة أزواج من الملابس الداخلية ذات الألوان المختلفة تتدلى من حبل الغسيل مع الناس والسيارات في الخلفية
125319704_49ead3463c.jpg,شخص يقف بجانب الدراجة
1253264731_e7c689eca5.jpg,فتاة في قميص مرجاني مع نظارات تبتسم
1253275679_e955fb7304.jpg,صبي صغير يرتدي قميصا أبيض وأسود
1255504166_f2437febcb.jpg,صبي يلعب في بحيرة
1258913059_07c613f7ff.jpg,ثلاثة أشخاص يجلسون على مقعد للنزهة في الخارج مع مظلة
1259936608_e3f0064f23.jpg,يلعب الأطفال في نافورة ماء
1260816604_570fc35836.jpg,شخص يقود سيارة حمراء
1262077938_8b9516c273.jpg,فتاة ذات محفظة سوداء جالسة على مقعد خشبي
1262454669_f1caafec2d.jpg,فتاة في قميص أبيض تجلس على مقعد في الحديقة مع كلب بجانبها
1262583859_653f1469a9.jpg,راكب الدراجة النارية يتمتع بالقهوة
1263126002_881ebd7ac9.jpg,طفلة تحاول أن تخرج من سريرها الأخضر
1263801010_5c74bf1715.jpg,رجل يرتدي سترة حمراء
1267711451_e2a754b4f8.jpg,كلب أبيض وأسود يحمل عصا كبيرة
1269470943_ba7fc49b4d.jpg,صبي مستلقٍ على العشب
1271210445_7f7ecf3791.jpg,احتفال بعيد الميلاد يقام لفتاة تبلغ الخامسة من العمر
1271960365_e54033f883.jpg,كلب أسود يركض خلف كلب أسود آخر يحمل كرة
1273001772_1585562051.jpg,مجموعة من الأطفال في نافورة ماء
127450902_533ceeddfc.jpg,أربعة أشخاص يسيرون في الثلج
127488876_f2d2a89588.jpg,شجرة في المقدمة ، رجلان يلعبان الجولف في الخلفية
127490019_7c5c08cb11.jpg,فتاة تستعد لدخول النادي
1277185009_06478dd457.jpg,رجل بدون قميص يسير على لكثير من الصخور
1277743944_f4e8c78403.jpg,صبي في سترة حمراء يركض على الشاطئ
1280147517_98767ca3b3.jpg,قارب على بحيرة
1280320287_b2a4b9b7bd.jpg,اثنين من الفتيان يتزلجان
1282392036_5a0328eb86.jpg,مجموعة من الناس في الزي في معرض نهضة
12830823_87d2654e31.jpg,الناس يحدقون في السمك البرتقالي
1285067106_2adc307240.jpg,صبي في الأبيض يلعب البيسبول
1285874746_486731a954.jpg,امرأة أفريقية أمريكية تقف في الحشد
1286408831_05282582ed.jpg,صبي صغير يتسلق مجموعة اللعب في الفناء الخلفي
1287064529_aa4e4f3c31.jpg,كلب أسود في الثلج
1287073593_f3d2a62455.jpg,مجموعة من الكلاب تسحب شخصاً على مزلق فوق تل
1287475186_2dee85f1a5.jpg,صبي يجلس في الماء
1287920676_d21a0b289b.jpg,كلب أبيض مع أحزمة حمراء عليه ينظر إلى الخلف
1287931016_fb015e2e10.jpg,كلب أسود وأبيض على الثلج
1287982439_6578006e22.jpg,كلب كبير بني يقفز في الماء ويفتح فمه
1288909046_d2b2b62607.jpg,كلب بني يقفز إلى بركة سباحة في الحديقة
128912885_8350d277a4.jpg,كلب يقفز على كرة حمراء على العشب
1289142574_2bd6a082dd.jpg,صبي يقفز من طاولة نزهة إلى أخرى
1290894194_8a4ffdc7eb.jpg,امرأة في لباس أحمر وكلب صغير يتحدث إلى فتاة صغيرة
1294578091_2ad02fea91.jpg,فنانة تعرض الرسم الخاص بها وتوقع ورقة
1295669416_21cabf594d.jpg,فتاة ترتدي ثوبا أحمر وأسود مع بنطلون أسود تجلس على الحائط
1295671216_cde1b9c9d1.jpg,رجل في البلوز الأزرق يلتقط صورة
1295698260_e10c53c137.jpg,حشد من الناس ينظرون إلى شيء خارج الإطار ، رجل يأخذ صورة
129599450_cab4e77343.jpg,راكب في الجبال يرتدي علم أمريكا
1296412797_85b6d2f8d6.jpg,طفلة تتأرجح من ذراعيها بينما يشاهد طفل آخر
1296770308_3db2022f5a.jpg,فتاة تجلس على مقعد بار
1298295313_db1f4c6522.jpg,صبي في سترة زرقاء يقفز في الماء
1298866571_b4c496b71c.jpg,رجل آسيوي يعطي العين الشريرة للكاميرا
1299459550_1fd5594fa2.jpg,صبي في ثياب السباحة
1299459562_ed0e064aee.jpg,ثلاثة أولاد يلعبون في رذاذ الماء
1301140633_046e4e8010.jpg,صبي في قميص أزرق مع الأوساخ على وجهه
130211457_be3f6b335d.jpg,رجل يضع ذراعيه حول امرأتين تمتثلان لصورة معه
1302657647_46b36c0d66.jpg,رجل يتدلى من القضبان في الهواء الطلق
1303335399_b3facd47ab.jpg,قام طفل صغير بالتزحلق على زحلوقة برتقالية
1303548017_47de590273.jpg,فتاة تقف على مسار القطار بالقرب من محطة
1303550623_cb43ac044a.jpg,فتاة تقف حافية على مسارات السكة الحديدية
1303727066_23d0f6ed43.jpg,رجل يلبس علامة سلام على قميصه يبتسم
1303727828_d1052ee341.jpg,رجل يرتدي قبعة الريش
1304100320_c8990a1539.jpg,الكلبان يركضان في حقل من الزهور
1304961697_76b86b0c18.jpg,طفلين على ألواح التزلج يلوحان لبعضهما البعض
1305564994_00513f9a5b.jpg,قاد المتسابقان الدراجة البيضاء على الطريق
1306145560_1e37081b91.jpg,كلب أسود يسبح في الماء
1307635496_94442dc21a.jpg,طفل يمر عبر حقل
1308472581_9961782889.jpg,فتاة ضاحكة تحمل دلوًا في المحيط
1308617539_54e1a3dfbe.jpg,صبي يقفز إلى المحيط
1309330801_aeeb23f1ee.jpg,يلعب الأطفال على الترامبولين
1311132744_5ffd03f831.jpg,كلب أسود ورمزي يركض في الحقل
1311388430_4ab0cd1a1f.jpg,شخص معلق في الهواء من خطوط الكهرباء
1312020846_5abb4a9be2.jpg,اثنين من الجراء الصغيرة تطارد بعضها البعض على جدار حجري
1312227131_771b5ed201.jpg,الكلاب تعمل في الصباح المشمس
1312954382_cf6d70d63a.jpg,فتاة ترتدي فستان أخضر وبرتقالي تمشي في الشارع حاملة بالون
1313693129_71d0b21c63.jpg,صبي وفتاة يقفون على ضفة النهر
1313961775_824b87d155.jpg,طفلة عائمة ترتدي سترة نجاة
1316247213_1d2c726dd5.jpg,لقطة مقرّبة لفتاة صغيرة تضحك
131632409_4de0d4e710.jpg,فتاة في البيكيني تمشي على طول الشاطئ مع غيوم ضخمة وشاطئ رملي خلفها
1317292658_ba29330a0b.jpg,صبي يتمتع  بالمطر
