image,caption
311267421_e204e643cf.jpg,كلب أبيض وأسود و كلب بني وأبيض يركضا في حقل عشبي أمام مجموعة الأشجار
3112821789_1f7c3bbb99.jpg,رجل ينفخ في أداة كهربائية بواسطة ميكروفون
3113322995_13781860f2.jpg,مجموعة من كلا الهاسكي تمر عبر الأرض الثلجية
3113682377_14fc7b62b0.jpg,اصدقتان تقفان لالتقاط صورة ليلا
3113769557_9edbb8275c.jpg,امرأة تقف و ذراعيها إلى جانبيها بينما أخرى تأخذ صورة
3114944484_28b5bb9842.jpg,فتاة ترتدي قميص أحمر تنظر إلى أمها في حشد من الناس يجلسون على كراسي بيضاء بلاستيكية
3115174046_9e96b9ce47.jpg,متزلج يطير من الدرج
3115354165_44dbeec6c1.jpg,متزلج في الهواء
3115901702_f07aa0ef74.jpg,امرأة تمشي وهي تنظر إلى هاتفها المحمول وينظر إليها الآخرون
3116011063_f4071ccce6.jpg,رجل يسقط عن لوح ركوب الأمواج في المحيط
3116039960_54d1d68145.jpg,فتاة تحمل بالون أزرق أثناء سيرها
311619377_2ba3b36675.jpg,امرأة تنظر إلى طبق مليء بالبخار
3116379964_86986750af.jpg,كلب وشخصان
3116731299_6139b25c18.jpg,يحمل كلب صغير عصا صغيرة في فمه
3116769029_f5a76f04ba.jpg,صبي في معطف أسمر يلقي بعض الأوراق الحمراء على الكاميرا
3116985493_04b1dc3345.jpg,سيدة وابنتها تقفزان في بركة سباحة
3117336911_a729f42869.jpg,أطفال يلعبون في بركة
3117562746_62f57a02b5.jpg,كلب يطارد كلب آخر
3118425885_f0cc035032.jpg,امرأة شابة تأكل في مطعم مزدحم
3118505332_b0792489b5.jpg,رجل وامرأة يقفان لالتقاط صورة
3118534315_cc03e5ddab.jpg,رجل يسجل شيئًا يحمل و هناك راية حمراء خلفه
3119076670_64b5340530.jpg,متزلج على الثلج يطير في الهواء
3119696225_b289efaec8.jpg,راكب الدراجة يقوم بأداء حيلة على الجرف قرب الماء
3119875880_22f9129a1c.jpg,صبي يتسلق الصخور
3119887391_212f379797.jpg,رجل وامرأة يبتسمان
3119887967_271a097464.jpg,رجل في سترة يشير إلى الكاميرا
3119903318_d032141839.jpg,رجل يرتدي سروالا قصيرا يقف بالقرب من تأثيرات خاصة متفجرة
3119913014_688d4997d7.jpg,رجل يرتدي سترة سوداء يمشي على ph[.
3120189281_1938460e85.jpg,رجل وطفل يمشيان على الثلج مع كلبين
3120266797_47e7d91614.jpg,تقف مجموعة في المسافة القريبة بينما تلقي السماء ضوءًا مثيرًا على بعض الغيوم
3120648767_812c72eabe.jpg,سائق دراجة ترابية في الصحراء
3120953244_b00b152246.jpg,صبي ينفخ فقاعات على الكاميرا
3121482932_f77ca12c01.jpg,رجل يلبس الجينز، يركب دراجة رباعية الدفع فوق الرمل
3121521593_18f0ec14f7.jpg,امرأة تحني رأسها على كتف امرأة أخرى
312156254_ef31dca5ed.jpg,كلب أسود يهجم على كرة على الأوراق
3122497129_d08f5729b8.jpg,كلبان يتقاتلان على الثلج
3122579598_14841c038a.jpg,جرو لعوب يعض قميص صبي صغير
3122606953_a979dd3d33.jpg,كلبان أسودان يمشيان عبر الثلج
3122773470_b622205948.jpg,مجموعة من الناس يحملون حقائبهم عبر حقل عشبي
3122888809_9ae9b4b9b2.jpg,كلب أسود وكلب بني يشمان أنوف بعضهما البعض
3122938209_2b2c6c1fab.jpg,رجل يرتدي لباسا أسود، يركب دراجة خضراء
3123351642_3794f2f601.jpg,متزلج في الجو ، بعد أن قفز منحدر
3123463486_f5b36a3624.jpg,كلب يجري
3123526484_02952e40fc.jpg,زوجان يقفان خارج أحد الشوارع
3123770450_cedc16d162.jpg,أيل و عدد من الديوك الرومية معا في الثلج
312427606_defa0dfaa8.jpg,فتاة ذات شعر أشقر تأكل الخوخ
3124549928_10904a5a83.jpg,طفل يستعد لرمي كرة ثلج
3124838157_7ef96745b7.jpg,رجل وامرأتان يقفون لأخذ صورة خارج بقالة
3124964754_2e8a98fb09.jpg,رجل يقفز على برميل أثناء التزلج
3125041578_c1f2d73b6d.jpg,متزلج على الجليد يتزلج حول الحلبة
3125158798_0743dae56e.jpg,رجل وامرأة يقفان لأخذ صورة في شارع مرصوف بالحصى
3125309108_1011486589.jpg,مجموعة من الرجال يحملون رجلا للحصول على كرة الرجبي
3125628091_25a31709df.jpg,طفلة صغيرة ترتدي بلوزة ذات أكمام طويلة خضراء و رأسها على وسادة
3126225245_96cd2c053f.jpg,أطفال صغار يلعبون بفقاعات يصنعها شخص بالغ
3126681108_f88128699c.jpg,فتاة صغيرة تجرف الثلج أمام منزل
3126724531_f483e1b92a.jpg,رجل يقف على لوح ركوب الأمواج ويهبط أسفل موجة كبيرة
3126752627_dc2d6674da.jpg,لاعب كرة سلة يحاول منع لاعب آخر من التسديد
3126773489_7ae425af17.jpg,لاعب كرة سلة يدافع ضد لاعب آخر
3126795109_73920ed5dc.jpg,لاعب كرة سلة أصلع يقف في الملعب و الكرة بيده اليمنى
3126981064_1e803c3d7f.jpg,رجل يرتدي بذلة سوداء يتصفح موجة كبيرة
3127142756_bf0bfcb571.jpg,كلبان أسودان على الثلج
3127614086_9f1d3cf73d.jpg,يحاول لاعب كرة سلة الحصول على كرة السلة من لاعب آخر
3127629248_a955b5763b.jpg,أربعة لاعبي كرة سلة ، أمام حشد من الناس
3127888173_9a9a8ac3bd.jpg,يقف الأطفال الصغار معا ويحصلون على جائزة عن شيء ما
3128164023_ebe8da4c32.jpg,الكلاب تطارد بعضها البعض
3128514681_a51b415c31.jpg,سيدتان ترتديان فساتين تقفان على جانب الطريق لأخذ صورة في الليل
3128856481_86e5df4160.jpg,بطة بيضاء تمد جناحيها في الماء
3130064588_6d1d3fa2dd.jpg,صبيان يجلسان على متن قارب في الماء
3130093622_362f32f2bb.jpg,كلب أسود وبني يقفز عبرالثلج
313051099_1bb87d6c56.jpg,صورة مقربة لوجه كلب أبيض بينما هو يحمل عصا في فمه
3130970054_04a3865c43.jpg,أربعة أطفال يقفزون إلى البركة
3131107810_7e9b96cddc.jpg,مجموعة من الأطفال يجلسون مقابل سياج مغطى ببطانية
3131160589_dc73c209b7.jpg,رجل يرتدي بدلة سانتا، يتسلق مبنى خرساني كبير
3131632154_098f86f4cb.jpg,كلبان أسودان يبحثان عن ألعاب في الثلج
3131990048_369b081021.jpg,طائر يغوص للحصول على بعض الطعام
3132006797_04822b5866.jpg,ثلاثة أطفال يلعبون على الأرض بالدمى
3132619510_7dfc947d25.jpg,كلبان يجريان على طول السياج
3132760860_3e743a935d.jpg,يقفز متزلج على الماء في الهواء بينما يمسك بحبل أصفر
3132832452_c354c6396c.jpg,عائلة تحيط بطفل في حضن أبيه
3132903412_b4780d0ccf.jpg,شخصان يشعران بالبرد يقفان بالقرب من عمود
3133044777_8cc930a4ec.jpg,منضدة فاكهة مع بائعها
313326614_b2adbe59e0.jpg,رجل مرتدي سترة حمراء، يقف في أعلى سلالم الملعب
3133403457_95dfe11da1.jpg,طفل يرتدي قفازات خضراء كبيرة
3133825703_359a0c414d.jpg,طفل يحدق في سانتا
3134092148_151154139a.jpg,رجل على لوح ركوب الأمواج
3134341610_3c55e373a7.jpg,سانتا وامرأة يشربان النبيذ بجانب شجرة الكريسماس و هما يرتديان نظارات تمويه مضحكة
3134385454_4f1d55333f.jpg,فتاة تقفز في بلاكة سباحة مع رجل بملابس لونها أسود
3134387321_3a253224c1.jpg,صورة مقربة لثلاثة أشخاص يبتسمون أمام الكاميرا
3134387513_ceb75bea0a.jpg,زوجان يتمتعان بشيء من الحياة الليلية، يبتسمان للكاميرا
3134585858_a8c3493ca5.jpg,رجل وامرأة يرتديان معاطف سوداء
3134586018_ae03ba20a0.jpg,زوجان يرتديان معاطف شتوية يستعدان لأخذ صورة
3134644844_493eec6cdc.jpg,رجل يعزف على الغيتار لفتاة صغيرة في المستشفى
3135504530_0f4130d8f8.jpg,فتاتان آسيويتان تضحكان معا
3135826945_f7c741e5b7.jpg,صبي يرتدي اللون الأصفر، يقرأ كتابًا
3136043366_b3f8607a0e.jpg,مجموعة من لاعبي كرة القدم يرتدون ثيابا لونها أزرق
3136404885_f4d8f1d15a.jpg,رجلان يسيران نحو مبنى  مرسوم عليه سيارة ضخمة
3136674757_57406c305c.jpg,رجل مسن يعانق فتاة أصغر سنا
3136688093_568b053bdf.jpg,رجل يقف على خشبة المسرح و ألعاب نارية تنطلق بجانبه
3137061312_eb5fdcf3fd.jpg,قطار تحت الارض
3138399980_d6ab8b2272.jpg,شخص يرتدي قميصاً برتقالياً يرفع يده في الهواء بينما يشاهدونه آخرون
3138433655_ea1d59e5b7.jpg,طفل يبتسم بينما يداه مشبوكتان أمامه
3138504165_c7ae396294.jpg,حارس المرمى يقف أمام المرمى في لعبة هوكي
3138562460_44227a35cf.jpg,حصان بني وأبيض يجري على الحصى
3138746531_f6b816c126.jpg,مجموعة من الناس يحرقون أشياء
3139118874_599b30b116.jpg,فتاتان تقفان أمام شجرة الكريسماس و أذرعهما حول بعضها البعض
3139160252_75109e9e05.jpg,ثلاث نساء يستعدن لاتقاط صورة أمام شجرة الكريسماس
3139238055_2817a0c7d8.jpg,أربعة أشخاص يبتسمون ويحملون لوحات ذهبية خلف رؤوسهم
3139389284_f01bd4c236.jpg,كلب أبيض صغير يقفز على الأرض
3139393607_f0a54ca46d.jpg,رجل ينزلق على طول حاجز أخضر على لوحه
3139837262_fe5ee7ccd9.jpg,صبي يقفز على مزلجة
3139876823_859c7d7c23.jpg,رجل يتزلج أسفل تلة ثلجية
3139895886_5a6d495b13.jpg,كلب أبيض وأسود يقفز فوق عشب أصفر عالي
3141293960_74459f0a24.jpg,رجل يرتدي قميصا أحمر، يتزلج
3141440149_00becbbb93.jpg,صبيان يقفان في مطبخ
3141613533_595723208d.jpg,صبيان يقفان في حقل ذرة فارغ في الشتاء
3142055158_01b9e4caa4.jpg,رجل يركض في ملعب مع الكرة ورجل في قميص مخطط موجود على الأرض
3143155555_32b6d24f34.jpg,طفلة صغيرة تلعب مع فتاة أخرى أصغر سناً
3143159297_6f2f663ea6.jpg,رجل أصلع يحمل طفلة صغيرة في مكتب
3143574389_8a4048fbe2.jpg,هناك حشد يشاهد عرضًا في مكان مظلم ، ويقوم أحد الأشخاص بالتقاط صورة
3143765063_a7761b16d3.jpg,رجل في قبعة صغيرة و يحمل مظلة بيضاء، يقف على الرصيف مع رجلين آخرين
3143953179_1c08c023a5.jpg,مجموعة من الناس تشاهد المتزلجين على الجليد
3143978284_ac086be9a3.jpg,امرأتان مع طفل
3143980056_7a64a94b58.jpg,طفل يلعب مع امرأة
3143982558_9e2d44c155.jpg,طفل رضيع يرتدي ملابس مقلمة ، يجلس بالقرب من سيدة أكبر سناً ترتدي ملابس حمراء وسوداء
3143991972_7193381aeb.jpg,امرأة ورضيع ينتظران مع الأمتعة
3144705706_391d7b77c7.jpg,طفل يلعب في كومة من الثلج في شارع بينما يراقب شخص بالغ
3145869775_85dfae43bd.jpg,امرأة في تنورة قصيرة وأحذية طويلة
3145967019_1a83ebf712.jpg,ثلاث نساء يشربون ويتعانقون
3145967309_b33abe4d84.jpg,زوجان متعانقان ينظران إلى بعضهما البعض
314603661_51e05e0e24.jpg,كلب بني ذو آذان كبيرة يمشي على السجادة بعد لعبة بنية
3146232740_df3da0163b.jpg,كلب أبيض وأسود يحمل عصا في فمه بينما يسبح في الماء الصافي
3146355833_1b7fc80210.jpg,طفل يحمل بالونا أصفرا
3146630574_05d9ebbed1.jpg,كلب أبيض وأسود يركض في الماء بينما يحمل شيئًا أحمر في فمه
314685044_da4390728e.jpg,امرأة في معطف أخضر تقف بجوار حامل منضدة هاتف
3146937399_8c046b7b1a.jpg,صبي وفتاة يمشيان في المياه الضحلة
3147217787_ed21cd4990.jpg,رجل أسود يغمس كرة في سلة بينما يقوم رجل آخر بمزاحمته في الملعب
3147758035_e8a70818cb.jpg,رجل على دراجة ورجل يسير على الأقدام في ممر للمشاة
3147913471_322ea231d9.jpg,لاعب كرة السلة يستعد لتصويب الكرة
3148193539_de9dd48fc8.jpg,ثلاثة صبية يرتدون قمصانا خضراء يتسلقون زحليقة
3148286846_40ae914172.jpg,طفلان يلعبان في قارب أخضر على العشب
3148571800_c5515e6c3d.jpg,رجل يحمل عصا بينما ينفجر من طرفها تيار من النيران
3148647065_2d6cd88cf6.jpg,كلب أصفر مع طوق يركض في منطقة مشجرة
3148811252_2fa9490a04.jpg,لاعب كرة سلة يحمل الكرة خلال المباراة
3149038044_c7c94688c6.jpg,طفل يستعد لرفع الكرة إلى طفل آخر
314904143_5a216a192b.jpg,رجل يحمل معدات تسلق الصخور يتدلى من صخرة عمودية بيضاء
314940358_ec1958dc1d.jpg,لقطة مقرّبة لرجل مسن يرتدي نظارات
3149804151_1cc8d10783.jpg,سائقا دراجات يتسابقان صعودا
3149919755_f9272b10b3.jpg,كلب أسود على الشاطئ ينظر إلى الكرة قرب المحيط
315021440_122d56ebd7.jpg,يركض الكلبان باتجاه الكاميرا
3150252702_828a570d46.jpg,شخص يركب لوح تزلج على الجليد  يتجاوز منحدر ثلجي
3150315970_8f045c41a4.jpg,رجل وامرأة ينظران إلى بعضهما البعض بينما يقفان علي شرفة داخلية متقنة الصنع
3150380412_7021e5444a.jpg,كلب بني يركض في الماء
3150440350_b0f2a9e774.jpg,رجل يرتدي زي عسكري ينحني للتحدث إلى شخص يجلس على الرصيف
3150659152_2ace03690b.jpg,رجل يصطاد في قارب أزرق مدبب على نهر محاط بأشجار النخيل
3150742439_b8a352e1e0.jpg,رجل يرتدي قبعة حمراء ينظر إلى الأسفل في حين يراقب رجل آخر
315125146_d9a8e60061.jpg,كلب أبيض وأسود يعض سترة شخص
3151365121_e2a685a666.jpg,كلب أبيض وأسود يمشي على طول الشاطئ الرملي
3151492269_28d8edaa68.jpg,كلب بني يركض بجانب سياج بينما يقف كلب لون أغمق في مكان قريب
3151860914_46e30cd5ea.jpg,صبي وكلب يلعبان بعصا
3152317129_177b4678b7.jpg,طفل يرتدي سترة نجاة في بركة سباحة
3153067758_53f003b1df.jpg,شخص في قميص أحمر يحمل كيسًا ورقيًا فوق عربة أمتعة
3153828367_5fc2c37c07.jpg,فتاة صغيرة في ثوب أسود تبتسم وهي تجلس في حضن سانتا
3154152744_4e93ec8a62.jpg,كلبان يجريان على الثلج و لعبة حمراء في فم أحدهما
3154293126_e52bd07524.jpg,متزلج على الثلج يطير في الهواء
315436114_6d386b8c36.jpg,الكلب البني يعض القفاز الأرجواني على الثلج
3154528397_89112faf4b.jpg,رجل يتزلج في الجو
3154641421_d1b9b8c24c.jpg,لاعب كرة سلة يستعد لتصويب الكرة
3154693053_cfcd05c226.jpg,كرة سلة
3154709407_9b0778cbeb.jpg,رجل أصلع يمشي بكرة السلة و هو يرتدي قميص ميامي
3154813159_58a195236d.jpg,كلب يقفز في الهواء
3154886184_ac842655b6.jpg,متزلج في الهواء يركب لوحه التزلج المقلوب
3155279929_d1cddbe7cf.jpg,كلب يهز بعد الخروج من المحيط
3155361712_2cbf59c78e.jpg,رجل يقفز و هو على لوح التزلج على الجليد
3155365418_43df5486f9.jpg,صبي يؤدي حيلة قفز على لوح التزلج على الجليد
3155390408_8e1a81efb2.jpg,كلب يمسك الكرة في فمه
3155400369_69e3d6d70f.jpg,عدد كبير من الناس يحملون طبولهم
3155451946_c0862c70cb.jpg,لاعب كرة السلة باللون الأبيض يحمل الكرة
3155501473_510f9c9f6b.jpg,امرأة شقراء و يدها على حلق فتاة شقراء
3155657768_b83a7831e5.jpg,مجموعة من الأطفال يلعبون في ساحة و رجل في الخلفية
3155987659_b9ea318dd3.jpg,كلب أبيض وأسود اللون يصطاد الفريسبي في الفناء
3156113206_53c2a7b5d8.jpg,ثلاثة أولاد يمشون على الصخور على طول النهر
3156406419_38fbd52007.jpg,متزلّج وحيد يرتدي حقيبة ظهر حمراء يتعثر أسفل جبل ثلجي
3156991513_3bf03333d8.jpg,رجل يرتدي خوذة سوداء يركب دراجته على درب
3157039116_d82da4e66b.jpg,يقف صبي في قميص أزرق عند سفح تلة مع كرة ثلجية في يده
3157220149_cc3c8cc84d.jpg,يسلم الرجلين في جينز أزرق وقبعات شتوية واقي ذكري
3157622277_9f59b4f62f.jpg,معركة الهوكي
3157744152_31ace8c9ed.jpg,يسير رجل حافي القدمين عبر ملعب تنس
3157847991_463e006a28.jpg,هؤلاء الرجال يدخنون خارج مبنى رمادي
3158327361_6f1a518228.jpg,رجل وامرأة يقفان فوق الرمال الساخنة
3158680604_c1f99b3946.jpg,عائلة تجلس، تعمل وتجري محادثات في المطبخ
315880837_90db309bab.jpg,تلعب ثلاثة كلاب على الثلج الأبيض
3159092624_66af4e207e.jpg,طفل يركض على العشب
3159424456_f316bdc1d5.jpg,رجل يحمل طفل على الطاولة في مطعم
3159447439_c1496cbaea.jpg,كلبان بنيان يركضان على العشب الأخضر
3159569570_dff24e7be9.jpg,مجموعة من الفتيات من السكان الأصليين ترتدي ألوان زاهية
3159641529_c2c74f3eaf.jpg,كلب يقفز عبر العشب
3159995270_17334ccb5b.jpg,امرأة تتزلج على الثلج
3160531982_37f5636b8a.jpg,تؤدي المظلة هبوطه و غروب الشمس خلفه
3161044966_27bf6f9dec.jpg,كلب أبيض و بني يقفز على كرسي جلد بيج
3162045919_c2decbb69b.jpg,رجل يرتدي بذلة سباحة يتزلج على موجة
3162095736_cc41dd41ff.jpg,مجموعة من الأطفال يلعبون في جدول
3162289423_4ca8915d0c.jpg,فتاة ترتدي بذلة خضراء ونظارات واقية مع غروب الشمس الجميل في الخلفية
3162442331_c9711857c6.jpg,فيل ملفوف بأقمشة حمراء وزرقاء وذهبية يسير على طريق حجري
3163068926_d28ed3ef53.jpg,رجل يمسك كوب يركب أسفل المصعد
3163198309_bbfe504f0a.jpg,متسابق قادم فوق تل ثلجي بينما ينظر الناس إليه
3163273640_8d3ef22eaf.jpg,مجموعة من الأفيال يركبها الرجال
3163281186_e2f43dfb5f.jpg,رجل يركب فيلًا بينما يلمس شخص آخر رأس الفيل
3163323414_d1ce127aa6.jpg,مجموعة من النساء في القمصان الحمراء يغنون
3163477256_073605e06e.jpg,رجل يمسك الكرة أمام حشد كبير
3163563871_cef3cf33ea.jpg,طفل في قبعة سوداء وشورت أزرق فاتح يلعب التنس
3164328039_2c56acf594.jpg,كلبان يحاولان الحصول على كرة صغيرة
3164347907_2813f8ff0b.jpg,شخصان يصوران في يوم ثلجي
3164415865_612f9fd8bc.jpg,يتزلج الأطفال على التل الثلجي
3164423279_9b27cb6a06.jpg,رجل يرتزحلق تلة ثلجية
3165123595_8db9f918bf.jpg,الناس يتزلجون على تلة مغطاة بالثلوج
3165750962_e2e3843679.jpg,كلب بني يجري على مسار مغطى بالثلج
316577571_27a0e0253e.jpg,كلب أبيض وكلب أبيض وأسود يركضان على العشب
3165826902_6bf9c4bdb2.jpg,صبي يتزلج على الحافة في مركز تزلج داخلي
3165936115_cb4017d94e.jpg,يبدو أن اثنين من الرجال يلعبان بصناديق في مركز تجاري
3166366760_e43cf66eda.jpg,شخص يركب دراجة على درب عبر بعض الأشجار
3166578139_33500f7e8a.jpg,متزلج يتمتع بالمنحدرات في يوم جميل
3166969425_b5ace2f9c2.jpg,كلب يمشي في مكان ضبابي
3167365436_c379bda282.jpg,رجل وامرأة يرتديان غطاء رأس يديران كاميرا الفيديو على أنفسهم
3167379087_927ff05a35.jpg,متسابق على الدراجات في الأحمر تتم ملاحقته من قبل متسابق آخر يرتدي الأزرق
3168123064_d1983b8f92.jpg,شخص يركب الأمواج
316833109_6500b526dc.jpg,كلب بني يركض عبر الفناء و لعبته في فمه
3168354472_866fe70d36.jpg,فتاة في ثوب أرجواني تبكي على الأرض
3168796547_0c14b368f9.jpg,طفلان يجلسان على ظهر حيوان
3168841415_c0705a327a.jpg,صبي في قميص بني يرمي الفريسبي
3169276423_6918dd4da1.jpg,زوجان كبار مع أقنعة غوشو ماركس و سيجار مزيف
3169394115_2193158cee.jpg,كلب يقف على مقعد على الثلج
3169591322_d0b6d0cd04.jpg,رجل يقوم بحيلة تزلج في موقف للسيارات
3169777863_d745865784.jpg,مجموعة من الراقصين يرتدون دنة سوداء يرقصون في الاستوديو
3170110692_d1e0e66cee.jpg,زوجان يرتديان قناعا مضحكا ويحملان سيجارًا مزيفًا
3170551725_1276644eab.jpg,شخص يفعل خدعة في الهواء على لوح التزلج
3170802797_3c851bb475.jpg,رجل يرتدي سترة خضراء وقبعة يتزلج على الجليد
3170856184_efabfd0297.jpg,الرجلين يلعبان لعبة الكريكيت في الملعب
3170897628_3054087f8c.jpg,مجموعة من الأولاد يلعبون كرة القدم في حقل موحل
3171035252_dba286ae5c.jpg,شخص يبحر بالمظلة على موجة
3171066023_ec60ba30f3.jpg,شخص يتزلج على تلة ثلجية ومليئة بالأشجار
317109978_cb557802e1.jpg,كلب بني يتسلق فوق فرع ساقط في منطقة مشجرة
3171188674_717eee0183.jpg,عامل في المدينة يرتدي سترة صفراء زاهية يبحث إلى حشد من الناس على جانب شارع مزدحم
3171250845_5ae0d2a8bc.jpg,يلعب فتى يرتدي بذلة بيضاء وسوداء مع كلب أسمر يرتدي طوقًا أحمر
3171347658_f0d5469c56.jpg,يجلس سائق يحمل خوذة بيضاء في سيارة سباق صفراء
3171451305_f87b9e09ee.jpg,رجل في قميص أحمر وامرأتان يحملون البيرة
3171651115_e07b9d08f6.jpg,راكب أمواج يركب موجة ضخمة يرتفع في الجو و ذراعيه مرفوعتان
3172280520_e7655fb596.jpg,رجل وفتاتان يبتسمون للكاميرا
3172283002_3c0fc624de.jpg,أربعة أشخاص يستعدون للحصول على صورة في الخارج
3172369593_eb4d787ffb.jpg,فتاة تحمل حقيبة صفراء تنظر إلى الصور في معرض للصور
3172384527_b107385a20.jpg,مجموعة كبيرة من الناس الآسيويين يأكلون في مطعم
3173014908_b3e69594b6.jpg,شخص يتزلج على الثلج
3173157541_70b16b4318.jpg,رجل يرتدي قبعة بيضاء يقف خلف امرأة تحمل شالاً أحمر فوق رأسها
3173215794_6bdd1f72d4.jpg,العديد من الناس يصطفون ، و امرأة تكتب
3173461705_b5cdeef1eb.jpg,اثنين من الكلاب في الثلج
317383917_d8bfa350b6.jpg,مجموعة من الكلاب تقف في الثلج
3173928684_4ea0ee5114.jpg,اثنين من الكلاب البيضاء الكبيرة تتقاتل على العشب
3173976185_8a50123050.jpg,كلب أبيض وأسود يقف على العشب و فمه مفتوح على مصراعيه
3174156702_95a1cda2d9.jpg,صبي يلعب في بركة وحل
3174196837_800689a2f3.jpg,مجموعة من الكلاب تركض عبر الحقل الثلجي
3174228611_6cf9d2266b.jpg,لاعب كرة سلة يرتدي قميصًا أحمر وأبيض أثناء جريه الملعب
3174417550_d2e6100278.jpg,صبي على لوح تزلج على الجليد أحمر في جوا
3174431688_ae84778db0.jpg,زوجين يقفان في الخارج في الظلام بالقرب من بعض أضواء الإحتفالات
3174453534_fcc927c647.jpg,امرأة تحمل طفلًا وهي مستلقية على الأريكة
3174713468_e22fa7779e.jpg,كلب يقفز لأخذ شيء من يد المرأة
3174726084_c108de0a64.jpg,يتم رفع العلم
317488612_70ac35493b.jpg,كلب يلعب في الثلج العميق
3175434849_859f09fe07.jpg,حشد من الناس في معرض أمام كشك حيث يمكن الفوز بدببة عملاقة
