image,caption
3487015378_2e90a79f4b.jpg,فتاة ترتدي ملابس مدبوغة خضراء أمام حشد من المهرجانات
3487131146_9d3aca387a.jpg,تقف مجموعة من الرجال بالقرب من شجرة بينما تثير سيارة سباق سحابة من الغبار على طريق الحصى بجانبها
3487261028_30791528ec.jpg,كلب بني غامق يقفز خلف فتاة صغيرة في السراويل القصيرة
3487378989_c051d2715b.jpg,رجل يقوم بحيل على دراجة
3487419819_e3f89444ce.jpg,دولفين فوق الماء
3487820317_3728e7569e.jpg,رجل يشرب العصير في يوم مشمس
3487979741_5f244c0c4b.jpg,رجل في قميص أخضر يركب دراجة في الغابة
3488087117_2719647989.jpg,كلب أبيض وأبيض يقفز على الرصيف
3488512097_e500cb499f.jpg,رجل يرتدي الملابس الرمادية ، بما في ذلك خوذة ، يتسابق في سباقات الدراجة الترابية على مسار ترابي
3488837187_0c7264a16c.jpg,يحمل طفل صغير ذو شعر أشقر كرة قدم حمراء وصفراء
3489774350_a94e6c7bfc.jpg,طفل يأكل الطعام ويبتسم أمام الكاميرا
3490044563_8eb551ef59.jpg,امرأة شابة ترتدي قناعا
3490186050_4cb4193d4d.jpg,صبي يلعب الكرة في حقل عشبي
3490517179_76dbd690de.jpg,مجموعة من الأولاد في الصحراء يلعبون مع كرة
3490528249_6aae9b867b.jpg,اثنين من السيارات سباق بعضها البعض وتصب الدخان من الخلف
3490597800_8f94f7d353.jpg,كلب واحد يقف على الشاطئ بينما يركض كلب آخر في المحيط
3490736665_38710f4b91.jpg,كلب كبير يقف على ساقه ويده كما يتم رمي كرات التنس اتجاهه
3490867290_13bcd3a7f0.jpg,امرأتان من شرق آسيا تجلس في الهواء الطلق خلف حيوان يشبه البقرة
3490874218_babb404b39.jpg,رجل في الأخضر على دراجة خضراء في الهواء بعد القفز من منحدر
3491013009_572cf2c18a.jpg,فتاة تقف في مجموعة ترتدي قميصًا أسود وحبات وردية اللون
3491607076_922ec561d9.jpg,رجل يحمل الكأس على المسرح
3492180255_0bd48a18f8.jpg,شخص في سترة وردي يجري على الميدان
3492383096_5bbc08f0da.jpg,الكلاب الثلاث تجري بالقرب من الشاطئ
3492734013_e6b177ed99.jpg,مشهد حشد مع الحمام في ساحة
3493000349_81c540e828.jpg,خمس فتيات آسيويين يلعبن في نافورة
3493255026_5fdaa52cbe.jpg,كلب يلعب بلعبة
3493479159_609ebe1b35.jpg,رجل يركب دراجة نارية حمراء
3493844822_c315a11275.jpg,رجل يركب الأمواج
3494105596_f05cb0d56f.jpg,شاب يرتدي قميصا أبيض وشورتا أحمر يركل الكرة
3494345896_dd6b32cfa3.jpg,زوج من الكلاب يلعب مع الكرة الأرجواني
3494394662_3edfd4a34c.jpg,لقطة مقربة من رجل مسن
3494723363_eaa6bc563b.jpg,رجل يرتدي بذلة سوداء يركب الأمواج في المحيط
3495349745_1b29a63571.jpg,رجل يساعد صبيًا على ركوب دراجة
3495453699_1c9faedf3c.jpg,رجل يقف لفتاة صغيرة ، ذراعيه ممدودة ، مع كنيسة كبيرة في الخلفية
3495490064_8db40a83af.jpg,رجل يصنع وجهًا كريهًا أثناء التعامل مع سمكة بجانب بحيرة
3496028495_431cfdc042.jpg,كلب بني يسبح في الماء مع كرة التنس في فمه
3496983524_b21ecdb0c7.jpg,صبي يقرأ كتابا
3497069793_2d4baf5b4b.jpg,طفل يلعب في منزل 
3497106366_d1a256e723.jpg,رجل يركب لوح ركوب الأمواج بينما تأتي موجة خلفه
3497224764_6e17544e0d.jpg,تكتب امرأة ذات شورت أحمر على قرص
3497234632_6ec740fc1e.jpg,مجموعة من لاعبي كرة السلة يقفون في ملعب كرة السلة
3497236690_a48bf7ac42.jpg,رجل في قميص أسود يقف في صالة الألعاب الرياضية
3497237366_366997495d.jpg,لاعب كرة سلة يحاول رمية الكرة في صالة للألعاب الرياضية
3497238310_2abde3965d.jpg,مجموعة من الرجال يقفون في صالة للألعاب الرياضية مع كرة السلة
3497255828_f27e009aac.jpg,فتاة باللون الوردي والأرجواني تتسلق سلم
3497485793_e36c1d2779.jpg,زوج من الشابات يعطين محاضرة لجمهور شاب
3497502407_ec566442c9.jpg,فتاة تقف على منصة تدريب عقبة
3498240367_cbd8c6efbf.jpg,يضع طفلان وجوههم في صورة فارس وملكة ملكية
3498327617_d2e3db3ee3.jpg,الكلب يجلب عصا من البحيرة
3498354674_b636c7992f.jpg,ينزلق لوح التزلج أسفل الدرابزين
3498417123_3eae6bbde6.jpg,مجموعة من الرجال يلعبون الكرة معا
3498423815_5b8fc097f4.jpg,صبي يبدأ ركوب الدراجة بينما يحمل الرجل ظهره
3498482871_4e02f31c35.jpg,اثنين من الثيران تسحب الشخص من خلال رش الأوساخ والطين
349889354_4b2889a9bd.jpg,راكب الأمواج هو في قاعدة الموجة القريبة من الشاطئ
3498997518_c2b16f0a0e.jpg,لاعب كرة قدم باللون الأزرق يمسك لاعب كرة قدم باللون الأبيض
3499720588_c32590108e.jpg,رجل ذو بشرة داكنة يلعب الغيتار الأزرق في الشارع
3500115252_9404c066a8.jpg,كلب أسود يلعب بدمية زرقاء على سجادة بيضاء
3500136982_bf7a85531e.jpg,واصطف مجموعة من المتدحرجين في الشارع
3500139659_b2a60b0141.jpg,يتسابق رجلان على الدراجات النارية في مضمار
3500342526_393c739e2f.jpg,كلب أسود يلعب داخل السياج
3500399969_f54ce5848f.jpg,سبعة أشخاص قفزوا إلى المياه الزرقاء الصافية
3500505549_d848209837.jpg,شخص يتدحرج على درابزين بواسطة رصيف مع الناس
3500829879_a643818d84.jpg,سائق دراجة يقود دراجة نارية حمراء على مضمار السباق
3501083764_cf592292a6.jpg,أم سوداء وخمسة أطفال في منطقة ريفية
3501206996_477be0f318.jpg,طفل في معطف بني يركل كرة قدم عبر حقل مفتوح
3501313414_ae865b6fdf.jpg,كلب بني يقفز على سياج من الاسلاك
3501386648_e11e3f3152.jpg,مجموعة من حوالي 11 شخصا من جميع الأعمار مع مناظير في الغابة
350176185_b8c5591e36.jpg,كلب يقفز على الدرج
3501781809_88429e3b83.jpg,رجل على دراجة يقفز فوق عامود أفقي مع حشد في الخلفية
3501936223_6122a13d27.jpg,شخص يتزلج على جبل كبير مغطى بالثلج
3502343542_f9b46688e5.jpg,امرأة ترتدي خوذة بيضاء تبحث عنها لأنها تهدئة جدار صخري ضخم
3502459991_fdec2da131.jpg,رجل يطلق النار على مسدس في ميدان الرماية
3502563726_30d1ce29c8.jpg,كلب أبيض يميل ضد كلب بلون ذهبي
3502897880_8392d0e4de.jpg,صبي يقفز أزرق اللون على لوح تزلج بينما يراقبه شخصان آخران
3502993968_4ee36afb0e.jpg,يتنقل متسابق الدراجة بالقميص الأخضر على طول الطريق
3503011427_a4ee547c77.jpg,رجل يرتدي قميصا أبيض اللون ونعله أسود يسير على الرصيف
3503471307_464a8f588c.jpg,صبي يقوم بقفز على دراجة هوائية في شارع 
3503544012_1771be9d3a.jpg,مجموعة من الرجال يلعبون الهوكي في الملعب
3503623999_bbd5dcfb18.jpg,رجل يرتدي قبعة حمراء و منديل أحمر على وجهه
3503624011_733d745d5a.jpg,امرأة ترتدي قبعة حمراء وطلاء وجه تبتسم على امرأة أخرى
3503689049_63212220be.jpg,أمريكي أفريقي في النظارات الشمسية و سترة بيضاء يبتسم
3504158556_1d410c8ff7.jpg,بعض الأولاد الصغار يتسكعون حول سيارتهم
3504275465_604ce2ef34.jpg,كلب أبيض يجري في النهر
350443876_c9769f5734.jpg,طفل صغير يتسلق السلم بعد شخص ما
3504479370_ff2d89a043.jpg,الشرطة البريطانية يقف في عرض
3504881781_6a842e043b.jpg,مجموعة من الرجال يقومون بتحميل مدفع
3504940491_94c43792ed.jpg,تحلق امرأة وطفل عبر الهواء ، جالسين على متن ملاهي
350529848_9569a3bcbc.jpg,كلب يطارد الكرة في الماء
3505657604_8899161734.jpg,فتاتان في ملابس ملونة داخل غرفة استحمام
350588129_6aef7b7fe2.jpg,كلب أسود يقفز في بركة السباحة
3506096155_13632955e8.jpg,متسابق الدراجة الترابية يقفز فوق منحدر
3506216254_04d119cac7.jpg,رجل يرتدي نظارة شمسية يدخن
3506468593_7e41a6d9f1.jpg,فتاة تتأرجح على كرمة فوق الماء
3506560025_8d0f4f9ac4.jpg,سيدة ذات شعر بني مجعد تقف في حشد مع كاميرا
3506607642_40037b3fbf.jpg,صبيان يركضان بعد كرة القدم خلال المباراة
3506869953_802f463178.jpg,رجل ينزلق على إطار كبير مدفون في الثلج العميق
3507076266_8b17993fbb.jpg,رجل يرتدي سترة بنية اللون يقود حصان أسود
3507670136_2e5f94accf.jpg,رجل في الأصفر يعمل خدعة الدراجة
3508051251_82422717b3.jpg,رجل مشرد يسير على الرصيف وحده
3508522093_51f6d77f45.jpg,صبي صغير يسقط من لوح التزلج الخاص به إلى كومة من الأوراق البنية في الطريق
3508637029_89f3bdd3a2.jpg,اثنين من لاعبي البيسبول الإناث تصل للكرة
3508882611_3947c0dbf5.jpg,كلب رمادي كبير يقفز فوق حاجز أبيض
3509575615_653cbf01fc.jpg,وهناك حشد يقف أمام مبنى بينما كان يمسك بالصحف ويحمل الأعلام
3509611207_7645b1d28d.jpg,مجموعة شابة من الفتيات تغطي شعرها متظاهرين معا خارج مبنى
3510218982_318f738b76.jpg,رجل يمارس الملاكمة
3510219078_670b6b3157.jpg,كلب أسود وكلب بني وأبيض يركض ويلعب
3510695264_ef460fa6cc.jpg,مجموعة من الرجال يرتدون قبعات بيضاء داخل مبنى صناعي مع  واحد يلتقط صورة    
3511062827_cd87871c67.jpg,كلب أسود يسحب جسم أرجواني بفمه
3511890331_6163612bb9.jpg,الفارس في الأزرق يعتلي حصانًا كستنائيًا على مسار ترابي عبر سياج خشبي
3512033659_7e8a0c2ffa.jpg,حشد من النساء الهندوس في القبعات
3512033861_a357bb58b6.jpg,حشد من الأجانب يقفون
3512127856_18a4c7aace.jpg,فتاة صغيرة باللون الوردي تقف في مدخل أصفر
3512791890_eb065b460a.jpg,فتاة وامرأة يجلسان على درج مغطى بالسجاد
3513265399_a32e8cfd18.jpg,ينزلق الطفل إلى صحن المنزل و الماسك ينتظر
3513362553_5fc5779e20.jpg,لاعب البيسبول
3514019869_7de4ece2a5.jpg,كلب أسود وبني يقفز فوق عامودين بلونين أرجواني وأبيض
3514179514_cbc3371b92.jpg,يحاول لاعب البيسبول التقاط الكرة بينما يهرع آخر نحو القاعدة
3514184232_b336414040.jpg,فتاة تمسك كرة البيسبول
3514188115_f51932ae5d.jpg,صبي وفتاة يمسك يديه يسير في مسار السكك الحديدية
3514194772_43ba471982.jpg,كلب بني يركض على العشب
3514278386_de2343577e.jpg,لاعب البيسبول في قميص أسود وضع علامة على لاعب في قميص أبيض
3514297698_0512623955.jpg,كلب أسود ورمادي يمسك كرة التنس على الشاطئ
3515358125_9e1d796244.jpg,كلب بني يطارد كرة على العشب
3515451715_ac5ac04efa.jpg,تدفع أم طفليها على الأرجوحة
3515665835_22e6fb1193.jpg,يقف متسابق الدراجة الترابية في الهواء
3515904775_f8acc5909e.jpg,كلب أبيض وأسود يحمل كرة برتقالية تخرج من الماء
3516267455_ca17cc1323.jpg,كلب في بحيرة
3516285214_59823b341e.jpg,يتصفح الشخص خلال موجة أثناء تعطله
3516299821_8f0375d221.jpg,لاعب البيسبول يضرب الكرة
3516312179_f520469038.jpg,فتاة في الزي الأحمر والأبيض تلوح بمضرب
3516521516_9950340b96.jpg,لاعب كرة قدم يركل الكرة مع لاعب آخر على الأرض المنقوعة
3516653997_98ec551a67.jpg,مجموعة من المراهقين تجمعوا في حفلة موسيقية
3516825206_5750824874.jpg,امرأة ورجل حافي القدمين يستلقيان على أرض صخرية
3516935867_78cf63c69c.jpg,يقوم الحصان الأسود وراكبه بالقيام ب 3 قفزات عالية في المنافسة
3516960094_87fb4889de.jpg,امرأة رياضية تقفز في الرمال
3517023411_a8fbd15230.jpg,راكب الدراجة النارية ركوب الخيل في الشارع
3517040752_debec03376.jpg,يميل شخص إلى الأمام للقبض على لعبة البيسبول بينما يقترب العداء من القاعدة
3517056462_483ee5a914.jpg,لاعبة الكرة اللينة ترمي الكرة
3517124784_4b4eb62a7a.jpg,ضربت لاعبة الكرة اللينة الكرة وتقترب نحو القاعدة الأولى
3517127930_5dbddb45f6.jpg,صبي يضرب الكرة في لعبة البيسبول
3517362674_0f5296de19.jpg,فتاة تهب فقاعات بشدة
3517466790_17c7753a1a.jpg,مجموعة من المراهقين يرتدون ملابس رسمية وينظرون إلى بعضهم البعض
3518118675_5053b3f738.jpg,رجل يركب الدراجة الهوائية الأحادية العجلة أسفل مجموعة من السلالم
3518126579_e70e0cbb2b.jpg,رجل يركب شيئًا في الأسفل
3518334317_bc40bae18d.jpg,رجل وامرأة يسيران بعيدا عن سوق في الهواء الطلق
3518443604_6da641f07d.jpg,شخصان يتكئان في مدخل وكل منهما يرتديان الجينز
3518608016_46453d8b18.jpg,امرأة تلعب مع كلب بني على طريق الحديقة
3518675890_2f65e23ff9.jpg,كلب بني يركض في حقل
3518687038_964c523958.jpg,رجل يستعد ليقذف الكرة
3518755601_cebf11e515.jpg,ثلاث فتيات يجلسن على الرمال على الشاطئ ياحذون وضعية أمام الكاميرا
351876121_c7c0221928.jpg,كلب كبير بني ينام بجوار قطة صغيرة سوداء وبيضاء
3519155763_045a6a55e2.jpg,الكلب البني لديه فمه مفتوح في انتظار التقاط لعبة زرقاء وصفراء
3519815055_304dc8e8d6.jpg,صبي يقفز من لوحة الربيع الصفراء
3519942322_b37d088aae.jpg,كلب يطارد لعبة الكلب على العشب
3520079657_b828d96d50.jpg,مجموعة من الناس تقفز في الرمال على الشاطئ
3520199925_ca18d0f41e.jpg,امرأة بشعر مجعد تلعب الكمان
3520321387_710ab74cda.jpg,سيدة تبتسم مع ابنها ذو الشعر الأشقر
3520617304_e53d37f0af.jpg,واحد بحري يقلب آخر إلى الأسفل
3520869880_2e8b7d7842.jpg,فتاة في ثوب أحمر وأسود تتظاهر أمام جدارية
3520922312_e58a6cfd9c.jpg,زوجان يسيران في الشارع
3520936130_9e90872560.jpg,رجل وامرأة يجلسان على مقعد خارج مبنى خشبي
3521201948_9049197f20.jpg,تمر خمس كلاب كبيرة عبر منطقة عشبية مسيجة بينما ترتدي كمامات
3521374954_37371b49a4.jpg,تقف طفلة وولد صغير بجوار الغيتار والطبل
3522000960_47415c3890.jpg,رجل يركت موجة على لوح التزلج الخاص به
3522025527_c10e6ebd26.jpg,طائرة هليكوبتر وطائرة صغيرة في الهواء
3522076584_7c603d2ac5.jpg,راكب الدراجة النارية يقوم بخدعة في الهواء
3522349685_f046f0e250.jpg,طفل يداعب كلب
3522749949_fb615cee47.jpg,رجل في ملعب لكرة القدم ، في زي ، على وشك ركلة كرة القدم
3522989916_f20319cc59.jpg,كلب باللون البني وكلب رمادي يلعب في العشب
3523471597_87e0bf3b21.jpg,زوجان ينظران إلى خريطة المنطقة
3523474077_16e14bc54c.jpg,رجل يحمل كاميرا رقمية واقفة خارج مبنى ضخم
3523559027_a65619a34b.jpg,كثير من الناس في تشكيل على الميدان
3523819210_99782628fc.jpg,رجل يجلس على كرسي معدني أزرق
352382023_7605223d1c.jpg,كلب يحمل عصا أثناء المشي في الماء
3523874798_9ba2fa46e3.jpg,صبي في قميص أبيض وخوذة خضراء يركب لوح التزلج أسفل بعض الخطوات
3523920786_0eb63993fd.jpg,كلب أسود يركض في طريق ، في وسط حقل
3523950181_414978964e.jpg,حارس المرمى هو الذي يغطي شبكته في حين يطارد لاعبين آخرين كرة الهوكي
3523972229_d44e9ff6d7.jpg,المتزلج يطير في الهواء
3524436870_7670df68e8.jpg,كلب بني يلعب بالفقاعات
3524519277_bd0c3e7382.jpg,رجل يتحدث إلى اثنين من الحراس وهو يحمل شرابًا
3524612244_64f00afec5.jpg,امرأة تصب النبيذ وتراقب التلفزيون
3524914023_4e96edb09f.jpg,لاعب بيسبول يحمل مضربه ويستعد للعبة
3524975665_7bec41578b.jpg,امرأة في معطف أصفر يقف على الرصيف
3525403875_7f95e0cbfe.jpg,كلب أبيض واحد يركض مع كرة التنس في فمه بينما يهرول كلب آخر على طول
3525417522_7beb617f8b.jpg,يمر كلب بني صغير عبر العشب أمام كلب آخر وأصحابه
3525453732_f74a38f111.jpg,طائر يطير منخفضًا مع انتشار أجنحته
3525841965_7814484515.jpg,اثنين من الأطفال الصغار يقفون في الخارج على طريق ترابي
3526018344_450c517a72.jpg,مجموعة من الكلاب تلعب
3526150930_580908dab6.jpg,امرأة وفتاة تشكلان وتبتسمان لالتقاط صورة
3526431764_056d2c61dc.jpg,امرأة تلتقط صورة تقف بجانب رجل طويل القامة وأمام رجل آخر يلتقط صورة أيضًا
3526805681_38461c0d5d.jpg,رجل يحمل علامة مع كلب على مقود
3526897578_3cf77da99b.jpg,كلب أسود يحمل دلو أحمر في فمه
3527184455_1a9c074ff2.jpg,رجل وامرأة وصبيان يجلسان على مقعد مع الزهور في الخلفية
3527261343_efa07ea596.jpg,رجل يفعل خدعة الساق مفتوحة أثناء القيام بالدراجة النارية على دراجته
3527524436_a54aca78a9.jpg,رجل في تيارات مائية  في بحيرة محاطة بالثلوج
3527590601_38d56abc29.jpg,صبي على دراجة يقفز فوق بعض التلال الرملية
3527682660_c5e9fa644a.jpg,مجموعة من الناس يجلسون حول مكتب
3527715826_ea5b4e8de4.jpg,فتاة في زحافات وردي وسراويل لعب التنس
3527926597_45af299eee.jpg,صبي على لوح التزلج يركب على منحدر
3528105511_12ff45dc9c.jpg,شخص على دراجة ترابية في الهواء
3528251308_481a28283a.jpg,رجل يركب لوح تزلج يقفز على حافة الخشب
3528902357_be2357a906.jpg,يحاول سائق الدراجة خدعة بينما يرتدي الحد الأدنى من معدات الحماية
3528966521_2e871ff6a1.jpg,عدائي الماراثون على الطريق أمام سلسلة الجبال
3529211822_1dabdb3a9c.jpg,كلب بني يشرب الماء من وعاء بينما يقفز كلب أسود إلى جواره
3529314899_b4e533bb76.jpg,لاعب الهوكي في الأبيض يحاول سرقة العفريت من لاعب آخر باللون الأحمر
3529721084_4b405baf54.jpg,اثنين من سائقي الدراجات النارية ، أحدهما بقناع ، يظهران في الشارع بدراجتهما
352981175_16ff5c07e4.jpg,المتزحلق يساعد زميله المتزحلق ينهض من الثلج
3530087422_7eb2b2c289.jpg,شخص يرتدي بدلة حمراء وبيضاء يركع على لوح التزلج ويهرب على الطريق
3530342993_a4a1f0e516.jpg,دراجة تقفز في الهواء
3530502404_f8c3a3f61c.jpg,رجل يلبس قناعًا وجلدًا أسود يجلس على دراجة نارية في الشارع
3530504007_3272c57e21.jpg,يقف ثلاثة رجال في حشد يتكلم
3530687486_6e6be53602.jpg,امرأة تنفخ على الهندباء
3530843182_35af2c821c.jpg,يمارس الزوجان طرقًا مختلفة لارتداء نظارة شمسية أمام سيارة حمراء
353180303_6a24179c50.jpg,امرأة ترتدي الملابس تضع ماكياج أثناء النظر في مرآة
3531811969_49af4c22f0.jpg,يقوم سائق الدراجة بخدعة
3532028205_9ddd7599f8.jpg,لاعب هوكي يجلس قليلا ، مع حشد كامل في الخلفية
3532098999_4e07a0a17e.jpg,الكلاب تتمتع بمطاردة بعضهم البعض في الحديقة
3532192208_64b069d05d.jpg,رجل في غرفة مع ثلاثة أشخاص آخرين يحملون كاميرا كبيرة
3532194771_07faf20d76.jpg,رجل يتجه لرؤية مع لوح ركوب الأمواج في يده
3532200762_b28c39d311.jpg,فتاة تركض على الشاطئ
3532205154_5674b628ea.jpg,رجل يفحص القلادة الجميلة التي ترتديها المرأة
3532412342_e0a004b404.jpg,طفل يدور في إطار كبير
3532539748_795d16ef07.jpg,رجل وطفلة يقفان في الفناء بجانب مقعد
3532587748_7e64bb223a.jpg,صبي يقف من جهة على الرصيف
3532593368_be10432e92.jpg,مجموعة كبيرة من الناس يمدون أيديهم في الهواء دفعة واحدة
3532761259_14026c1e96.jpg,امرأة وامرأة شابة تضعان أذرعهما حول بعضهما البعض
3532782283_341f0381a3.jpg,ثلاثة أشخاص يواجهون الجبال
3533145793_5d69f72e41.jpg,تقوم مجموعة من الأطفال بالتمدد على الحصائر الملونة
3533394378_1513ec90db.jpg,يتم ربط رجل وامرأة في جولة معدنية دائرية
3533451027_b078e4631b.jpg,رجل أسود وأبيض يمسك كرة بشريط أحمر وأزرق
3533470072_87a5b595ba.jpg,فتاتان يعطيان علامة السلام
3533484468_0787830d49.jpg,رجل يقف إلى جوار امرأة وهو يحمل جهازًا إلكترونيًا في أذنه
3533660418_f3a73a257c.jpg,ثلاثة رجال يجلسون تحت المظلة
3533775651_9d7e93dacf.jpg,شخص باللون الأحمر يفتح باب سيارة حمراء في منطقة وقوف السيارات
3533922605_a2b1e276f6.jpg,فتاتان يجلسان على أرضية خشبية أمام نافذة كبيرة
3534046564_4f8546e364.jpg,كلبان يقتربان من بعضهما البعض في العشب
3534183988_3763593dfb.jpg,رجل يلبس كقرصان يبتسم للكاميرا بين ذكر وأنثى
3534512991_f9fd66f165.jpg,رجل وامرأة أمام الزهور الصفراء
3534548254_7bee952a0e.jpg,فتاة في قميص أصفر ترمي كرة قدم مبللة
3534668485_6887629ff0.jpg,تقف امرأة بيضاء ومرأة سوداء تتحدثان على الهاتف المحمول
3534824784_7133119316.jpg,فتاة تتكئ على كتف امرأة أثناء الجلوس على مقعد
3534952095_975cca0056.jpg,سيدة تركب دراجة نارية صغيرة
3535056297_e16f014cb7.jpg,مجموعة من الناس اغلبية رجال يشاهدون شيئا
3535084928_858544f49a.jpg,الكلاب البنيّة تلعق أنفها الأسود
3535284878_f90f10236e.jpg,كلب أبيض يركض على شاطئ صخري
3535304540_0247e8cf8c.jpg,تركت طائرة حمراء دخانًا أبيض خلفها
3535372414_4c51c86fc4.jpg,امرأة مسنة وفتاة صغيرة تقف أمام شجيرة كبيرة مغطاة بالورود الوردية
3535664885_c848c0faee.jpg,هوكي حارس المرمى يحاول منع تسديدة من برايان نوجنت
3535768334_a3924bcccd.jpg,صبي على دراجته يرتدي قميصًا أزرقًا وهو في الجو
3535879138_9281dc83d5.jpg,حشد من الناس يلوحون بالأعلام الحمراء يمرون تحت جسر
3536561454_e75993d903.jpg,رجل يرتدي خوذة سوداء وبنطلون أسود وقميص يركب لوحه في حديقة
3537201804_ce07aff237.jpg,طفل يدور على دوامة
3537218226_478d2e4f26.jpg,شخص يتسلق الصخور ورجل آخر على الأرض يحمل الحبل
3537400880_8f410d747d.jpg,فتاة تقوم بإنشقاقات في الهواء بينما تقفز على الترامبولين
3537452619_3bd79f24e0.jpg,يوازن صبي يرتدي بنطال جينز وأحذية حمراء اللون على شريط أحمر
